Username,Video Title,Published At
LordofKeeper,kurs,2009-04-25T11:03:13Z
LordofKeeper,Ch racing WSM 50,2008-05-11T15:26:20Z
LordofKeeper,Husyk 125 Swiss Power,2008-03-11T20:42:21Z
LordofKeeper,Ch Racing WSM 50,2008-01-09T16:59:24Z
LordofKeeper,Battlefield 2 Allied Intent .2 MOD,2007-07-28T11:06:59Z
LordofKeeper,B?hse Onkelz - Prinz Valium,2007-04-03T12:13:12Z
LordofKeeper,B?hse Onkelz - Du bist Skinhead/stolz,2007-03-29T14:30:59Z
LordofKeeper,Wizo -  Kopfschuss,2007-01-18T17:09:59Z
LordofKeeper,BF2 Owned/Cheat,2007-01-07T16:41:13Z
LordofKeeper,Der Zauber trick,2006-11-13T11:49:11Z
LordofKeeper,Battlefield 2 Stunt Video by clan -]GWA[-,2006-10-16T14:13:33Z
LordofKeeper,BF2 Stundt Video vom Clan -]GWA[-,2006-10-08T18:21:19Z
LordofKeeper,BF2 -]GWA[- Clan Video,2006-10-04T10:57:32Z
LordofKeeper,Ghost Recon Dance,2006-09-23T11:28:11Z
LordofKeeper,Battlefield 2 Cheater,2006-09-23T09:55:59Z
LordofKeeper,Die Gamers Wollen Singen,2006-05-23T19:13:59Z
LordofKeeper,Mick-Schweiz,2006-05-20T18:46:28Z
darksazzo,Night driving,2010-10-09T15:55:24Z
darksazzo,Pickled Wedding,2007-09-21T03:10:00Z
darksazzo,Me and Lizzie Getting a MakeOver,2007-08-18T22:12:16Z
darksazzo,Mum's MakeOver,2007-08-18T21:54:04Z
darksazzo,To Clear Up The Scottish MakeOver,2007-08-18T19:12:56Z
darksazzo,A Scottish MakeOver!,2007-08-18T18:25:09Z
darksazzo,No Room In Hell - AS Coursework 2006,2007-08-08T17:10:43Z
darksazzo,Muahaha the power of bottle top!,2007-08-08T14:42:59Z
darksazzo,funny laugh,2007-08-07T23:52:24Z
darksazzo,Carling Cup Tower Part 2,2006-06-18T13:58:29Z
darksazzo,Hyde Park Crowd,2006-06-18T13:56:05Z
darksazzo,Carling Cup Tower Part 1,2006-06-18T13:53:40Z
darksazzo,Lasers!!!,2006-06-18T13:43:36Z
darksazzo,HYde Park - Foofighters,2006-06-18T13:17:58Z
darksazzo,Hyde Park - Foofighters With Lemmy,2006-06-18T13:14:31Z
darksazzo,No Room In Hell,2006-03-08T19:33:02Z
Previewh,Hope,2011-04-03T12:11:47Z
Previewh,gettin fuc*ked,2011-04-03T11:41:51Z
Previewh,irish guy not so happy,2011-04-03T11:21:28Z
Previewh,Revolution OS - Open Source Copyright,2009-06-14T11:48:53Z
Previewh,meat consumption,2009-06-14T10:57:37Z
Previewh,one dollar = one vote? economy & democracy.,2009-01-03T06:19:15Z
Previewh,the trappings of power,2009-01-02T13:37:28Z
Previewh,Does he really think the most votes will win ?,2008-10-12T05:32:27Z
Previewh,what is our goal?,2008-10-12T02:57:14Z
Previewh,We are Beautiful - Zeitgeist,2007-12-01T22:20:32Z
Previewh,the American public manipulated by major news channels,2007-04-01T02:51:38Z
Previewh,Why content creators will be unable to limit distribution,2007-01-30T11:55:02Z
Previewh,The Cult of Mac - Belonging Through Branding,2007-01-26T13:19:26Z
Previewh,"why YOU should watch Fox, Al Jazeera & the BBC every day",2007-01-26T13:08:02Z
Previewh,Violent Resistance,2006-11-19T10:38:46Z
Previewh,Malcolm X - Who are YOU ??,2006-11-19T10:21:19Z
Previewh,Israel's influence of US policy & the Israeli lobby,2006-11-08T13:26:28Z
Previewh,Summertime put you back,2006-11-07T12:36:21Z
Previewh,Orwell Rolls in his Grave,2006-10-05T12:52:28Z
Previewh,Atomic Cafe,2006-09-17T15:02:05Z
Previewh,The Matrix - controlling society,2006-09-10T09:24:01Z
Previewh,When the Smoke Clears,2006-09-10T08:57:13Z
Previewh,Whats happened,2006-09-10T08:48:14Z
Previewh,What does Propoganda look like in a democracy,2006-09-10T04:39:07Z
Previewh,Blowback definition,2006-09-07T10:38:49Z
Previewh,Them fightin words!,2006-08-13T09:46:48Z
Previewh,The power of nightmares,2006-08-13T09:43:32Z
Previewh,Life in Palestine,2006-08-06T14:18:08Z
Previewh,Defence,2006-08-04T14:33:14Z
Previewh,Happiness = Materialism?,2006-08-04T14:18:03Z
Previewh,Epic scene,2006-08-01T11:18:31Z
Previewh,2500 anniversary Persian Monarchy,2006-07-07T12:57:45Z
Previewh,Iraq - what you didn't get to see,2006-07-04T12:14:21Z
Previewh,"Iraq, North Korea, Iran - Which is the Odd One Out?",2006-07-04T11:18:25Z
Previewh,The most poignant words ever spoken by a President,2006-07-01T18:24:15Z
Previewh,Our friend Dick Cheney,2006-07-01T18:16:48Z
Previewh,Commodities Trader speaks on 9/11,2006-06-29T14:57:21Z
Previewh,using the mass media to control society,2006-06-29T13:47:37Z
Previewh,mass media and the questioning of authority.,2006-06-29T13:45:15Z
Previewh,"Business, media & politics.",2006-06-29T13:23:35Z
Previewh,Deregulation and Free Markets,2006-06-29T13:22:36Z
Previewh,Coldplay Live,2006-06-27T23:31:45Z
Previewh,Rose Bay Sydney,2006-06-18T11:13:29Z
Previewh,Defend Your turf,2006-06-18T10:39:05Z
justinscartoons,Easter Egg Factory,2007-05-08T18:18:02Z
justinscartoons,Farting Phil,2006-09-05T20:02:20Z
justinscartoons,Monster In Town,2006-07-17T15:55:30Z
justinscartoons,Musical Pencils,2006-07-17T15:49:10Z
justinscartoons,Baby Rabbits / Dancing Rabbits,2006-07-15T14:08:16Z
parkcitytv,"""Obsessed Boyfriend""",2016-07-04T04:28:30Z
parkcitytv,VIVE!!! MICROSOFT INTRODUCES VIRTUAL REALITY!!,2016-05-25T05:39:49Z
parkcitytv,Unarmed black men shot by cops.,2015-08-31T16:35:59Z
parkcitytv,"""Fear of a Black Nation"" MUST SEE",2015-04-05T22:51:43Z
parkcitytv,Lil Wayne vs Chocolate Drop,2015-03-17T13:20:29Z
parkcitytv,Local rapper thinks he can battle anyone,2014-03-12T19:07:52Z
parkcitytv,Sesamill talking to his football team,2014-02-09T09:30:17Z
parkcitytv,Da beat goes on..,2013-03-13T03:27:27Z
parkcitytv,Behind the scenes of the "We be out here" video,2012-08-26T04:41:37Z
parkcitytv,Kamikaze @ Mclevy Hall,2012-07-22T06:34:30Z
parkcitytv,Crime Kids pickin a lock,2012-06-13T18:37:36Z
parkcitytv,Dr. Shine,2012-06-02T09:41:41Z
parkcitytv,Lil Diamond rappin on Ocean Drive,2012-06-01T10:14:37Z
parkcitytv,"""Cake"" trailer",2012-04-17T04:52:51Z
parkcitytv,Preparation by Sesamill,2012-03-26T14:35:03Z
parkcitytv,Jae and Ses Freestyle in Ice o lated Studios,2012-03-26T14:18:48Z
parkcitytv,Ccf at 106.5 fm,2012-02-21T11:54:48Z
parkcitytv,#ItzyaboyJae,2012-02-21T11:54:18Z
parkcitytv,QB FITZPATRICK OF THE BILLS  ACTIN A LIL TOO HAPPY AFTER TOUCHDOWN,2012-01-01T19:41:11Z
parkcitytv,In norwich,2011-12-25T18:48:16Z
parkcitytv,TEAMCCF ON DA WAY TO MANHATTEN,2011-12-23T04:03:18Z
parkcitytv,Before lady law mixtape release party,2011-11-27T01:44:11Z
parkcitytv,Flip da Skript and da Crime Fam: Tea Cup'n,2011-11-10T20:23:10Z
therebelangel,The Rebel Angel in "A Dark Date",2008-08-01T23:07:24Z
therebelangel,The Rebel Angel - Movie Trailer,2008-08-01T20:54:54Z
therebelangel,The Devil's Snake - The Rebel Angel,2008-08-01T18:44:47Z
therebelangel,Temptation - The Rebel Angel,2006-08-12T16:28:24Z
LordofKeeper,kurs,2009-04-25T11:03:13Z
LordofKeeper,Ch racing WSM 50,2008-05-11T15:26:20Z
LordofKeeper,Husyk 125 Swiss Power,2008-03-11T20:42:21Z
LordofKeeper,Ch Racing WSM 50,2008-01-09T16:59:24Z
LordofKeeper,Battlefield 2 Allied Intent .2 MOD,2007-07-28T11:06:59Z
LordofKeeper,B?hse Onkelz - Prinz Valium,2007-04-03T12:13:12Z
LordofKeeper,B?hse Onkelz - Du bist Skinhead/stolz,2007-03-29T14:30:59Z
LordofKeeper,Wizo -  Kopfschuss,2007-01-18T17:09:59Z
LordofKeeper,BF2 Owned/Cheat,2007-01-07T16:41:13Z
LordofKeeper,Der Zauber trick,2006-11-13T11:49:11Z
LordofKeeper,Battlefield 2 Stunt Video by clan -]GWA[-,2006-10-16T14:13:33Z
LordofKeeper,BF2 Stundt Video vom Clan -]GWA[-,2006-10-08T18:21:19Z
LordofKeeper,BF2 -]GWA[- Clan Video,2006-10-04T10:57:32Z
LordofKeeper,Ghost Recon Dance,2006-09-23T11:28:11Z
LordofKeeper,Battlefield 2 Cheater,2006-09-23T09:55:59Z
LordofKeeper,Die Gamers Wollen Singen,2006-05-23T19:13:59Z
LordofKeeper,Mick-Schweiz,2006-05-20T18:46:28Z
darksazzo,Night driving,2010-10-09T15:55:24Z
darksazzo,Pickled Wedding,2007-09-21T03:10:00Z
darksazzo,Me and Lizzie Getting a MakeOver,2007-08-18T22:12:16Z
darksazzo,Mum's MakeOver,2007-08-18T21:54:04Z
darksazzo,To Clear Up The Scottish MakeOver,2007-08-18T19:12:56Z
darksazzo,A Scottish MakeOver!,2007-08-18T18:25:09Z
darksazzo,No Room In Hell - AS Coursework 2006,2007-08-08T17:10:43Z
darksazzo,Muahaha the power of bottle top!,2007-08-08T14:42:59Z
darksazzo,funny laugh,2007-08-07T23:52:24Z
darksazzo,Carling Cup Tower Part 2,2006-06-18T13:58:29Z
darksazzo,Hyde Park Crowd,2006-06-18T13:56:05Z
darksazzo,Carling Cup Tower Part 1,2006-06-18T13:53:40Z
darksazzo,Lasers!!!,2006-06-18T13:43:36Z
darksazzo,HYde Park - Foofighters,2006-06-18T13:17:58Z
darksazzo,Hyde Park - Foofighters With Lemmy,2006-06-18T13:14:31Z
darksazzo,No Room In Hell,2006-03-08T19:33:02Z
Previewh,Hope,2011-04-03T12:11:47Z
Previewh,gettin fuc*ked,2011-04-03T11:41:51Z
Previewh,irish guy not so happy,2011-04-03T11:21:28Z
Previewh,Revolution OS - Open Source Copyright,2009-06-14T11:48:53Z
Previewh,meat consumption,2009-06-14T10:57:37Z
Previewh,one dollar = one vote? economy & democracy.,2009-01-03T06:19:15Z
Previewh,the trappings of power,2009-01-02T13:37:28Z
Previewh,Does he really think the most votes will win ?,2008-10-12T05:32:27Z
Previewh,what is our goal?,2008-10-12T02:57:14Z
Previewh,We are Beautiful - Zeitgeist,2007-12-01T22:20:32Z
Previewh,the American public manipulated by major news channels,2007-04-01T02:51:38Z
Previewh,Why content creators will be unable to limit distribution,2007-01-30T11:55:02Z
Previewh,The Cult of Mac - Belonging Through Branding,2007-01-26T13:19:26Z
Previewh,"why YOU should watch Fox, Al Jazeera & the BBC every day",2007-01-26T13:08:02Z
Previewh,Violent Resistance,2006-11-19T10:38:46Z
Previewh,Malcolm X - Who are YOU ??,2006-11-19T10:21:19Z
Previewh,Israel's influence of US policy & the Israeli lobby,2006-11-08T13:26:28Z
Previewh,Summertime put you back,2006-11-07T12:36:21Z
Previewh,Orwell Rolls in his Grave,2006-10-05T12:52:28Z
Previewh,Atomic Cafe,2006-09-17T15:02:05Z
Previewh,The Matrix - controlling society,2006-09-10T09:24:01Z
Previewh,When the Smoke Clears,2006-09-10T08:57:13Z
Previewh,Whats happened,2006-09-10T08:48:14Z
Previewh,What does Propoganda look like in a democracy,2006-09-10T04:39:07Z
Previewh,Blowback definition,2006-09-07T10:38:49Z
Previewh,Them fightin words!,2006-08-13T09:46:48Z
Previewh,The power of nightmares,2006-08-13T09:43:32Z
Previewh,Life in Palestine,2006-08-06T14:18:08Z
Previewh,Defence,2006-08-04T14:33:14Z
Previewh,Happiness = Materialism?,2006-08-04T14:18:03Z
Previewh,Epic scene,2006-08-01T11:18:31Z
Previewh,2500 anniversary Persian Monarchy,2006-07-07T12:57:45Z
Previewh,Iraq - what you didn't get to see,2006-07-04T12:14:21Z
Previewh,"Iraq, North Korea, Iran - Which is the Odd One Out?",2006-07-04T11:18:25Z
Previewh,The most poignant words ever spoken by a President,2006-07-01T18:24:15Z
Previewh,Our friend Dick Cheney,2006-07-01T18:16:48Z
Previewh,Commodities Trader speaks on 9/11,2006-06-29T14:57:21Z
Previewh,using the mass media to control society,2006-06-29T13:47:37Z
Previewh,mass media and the questioning of authority.,2006-06-29T13:45:15Z
Previewh,"Business, media & politics.",2006-06-29T13:23:35Z
Previewh,Deregulation and Free Markets,2006-06-29T13:22:36Z
Previewh,Coldplay Live,2006-06-27T23:31:45Z
Previewh,Rose Bay Sydney,2006-06-18T11:13:29Z
Previewh,Defend Your turf,2006-06-18T10:39:05Z
justinscartoons,Easter Egg Factory,2007-05-08T18:18:02Z
justinscartoons,Farting Phil,2006-09-05T20:02:20Z
justinscartoons,Monster In Town,2006-07-17T15:55:30Z
justinscartoons,Musical Pencils,2006-07-17T15:49:10Z
justinscartoons,Baby Rabbits / Dancing Rabbits,2006-07-15T14:08:16Z
parkcitytv,"""Obsessed Boyfriend""",2016-07-04T04:28:30Z
parkcitytv,VIVE!!! MICROSOFT INTRODUCES VIRTUAL REALITY!!,2016-05-25T05:39:49Z
parkcitytv,Unarmed black men shot by cops.,2015-08-31T16:35:59Z
parkcitytv,"""Fear of a Black Nation"" MUST SEE",2015-04-05T22:51:43Z
parkcitytv,Lil Wayne vs Chocolate Drop,2015-03-17T13:20:29Z
parkcitytv,Local rapper thinks he can battle anyone,2014-03-12T19:07:52Z
parkcitytv,Sesamill talking to his football team,2014-02-09T09:30:17Z
parkcitytv,Da beat goes on..,2013-03-13T03:27:27Z
parkcitytv,Behind the scenes of the "We be out here" video,2012-08-26T04:41:37Z
parkcitytv,Kamikaze @ Mclevy Hall,2012-07-22T06:34:30Z
parkcitytv,Crime Kids pickin a lock,2012-06-13T18:37:36Z
parkcitytv,Dr. Shine,2012-06-02T09:41:41Z
parkcitytv,Lil Diamond rappin on Ocean Drive,2012-06-01T10:14:37Z
parkcitytv,"""Cake"" trailer",2012-04-17T04:52:51Z
parkcitytv,Preparation by Sesamill,2012-03-26T14:35:03Z
parkcitytv,Jae and Ses Freestyle in Ice o lated Studios,2012-03-26T14:18:48Z
parkcitytv,Ccf at 106.5 fm,2012-02-21T11:54:48Z
parkcitytv,#ItzyaboyJae,2012-02-21T11:54:18Z
parkcitytv,QB FITZPATRICK OF THE BILLS  ACTIN A LIL TOO HAPPY AFTER TOUCHDOWN,2012-01-01T19:41:11Z
parkcitytv,In norwich,2011-12-25T18:48:16Z
parkcitytv,TEAMCCF ON DA WAY TO MANHATTEN,2011-12-23T04:03:18Z
parkcitytv,Before lady law mixtape release party,2011-11-27T01:44:11Z
parkcitytv,Flip da Skript and da Crime Fam: Tea Cup'n,2011-11-10T20:23:10Z
therebelangel,The Rebel Angel in "A Dark Date",2008-08-01T23:07:24Z
therebelangel,The Rebel Angel - Movie Trailer,2008-08-01T20:54:54Z
therebelangel,The Devil's Snake - The Rebel Angel,2008-08-01T18:44:47Z
therebelangel,Temptation - The Rebel Angel,2006-08-12T16:28:24Z
johnrehman,Israel Lobby (Part 2),2007-07-07T08:23:09Z
johnrehman,Israel Lobby,2007-07-01T10:10:59Z
johnrehman,Tupac and Outlawz,2006-10-06T07:38:32Z
johnrehman,Dan Marino,2006-10-06T06:46:57Z
jamiewatto,Foo Fighters Live in Sydney Opera House,2006-10-07T07:15:30Z
jamiewatto,Foo`s Opera House,2006-10-07T07:13:25Z
inmytree,Respect My Cumberbatch,2021-07-18T01:03:23Z
inmytree,#FooFighters @ Dreamfest #DF15 #Salesforce,2015-11-26T09:03:29Z
inmytree,Anthony Bourdain describing a nightmare involving Guy Fieri,2015-07-27T06:02:43Z
inmytree,Pearl Jam - Faithfull - Oakland - 11/26/13,2013-11-28T13:27:41Z
inmytree,"NIN - Find My Way - Outside Lands 2013 (Golden Gate Park, SF)",2013-08-15T08:38:23Z
inmytree,"NIN - March of the Pigs - Outside Lands 2013 (Golden Gate Park, SF)",2013-08-15T08:23:24Z
inmytree,"NIN - 1,000,000 - Outside Lands 2013 (Golden Gate Park, SF)",2013-08-15T08:09:44Z
inmytree,"NIN - Came Back Haunted - Outside Lands 2013 (Golden Gate Park, SF)",2013-08-15T07:58:14Z
inmytree,"NIN - Copy of A - Outside Lands 2013 (Golden Gate Park, SF)",2013-08-15T07:46:43Z
inmytree,Yeah Yeah Yeahs - Sacrilege - Outside Lands SF 2013,2013-08-15T07:41:30Z
inmytree,NIN crew setting up for Outside Lands 2013,2013-08-15T07:39:49Z
inmytree,Jurassic 5 - Outside Lands 2013 - clip,2013-08-15T07:32:03Z
inmytree,Pearl Jam - Elderly Woman.. - Bridge School Benefit 10/24/10,2010-10-25T10:26:31Z
inmytree,Pearl Jam - Black - Bridge School Benefit 10/24/10,2010-10-25T10:04:28Z
inmytree,Pearl Jam - Just Breathe - Bridge School 10/24/10,2010-10-25T09:40:43Z
inmytree,Pearl Jam - Lukin - Bridge School 10/24/10,2010-10-25T09:05:31Z
inmytree,Pearl Jam + Neil Young - Walk With Me - Bridge School 10/24/10,2010-10-25T09:04:04Z
inmytree,"Pearl Jam - The End (partial, missed the first part) - Bridge School 10/24/10",2010-10-25T08:45:04Z
inmytree,Pearl Jam - Other Side - Bridge School 10/24/10,2010-10-25T08:33:07Z
inmytree,dancey,2010-10-25T08:31:14Z
inmytree,Pearl Jam - Driftin' - Bridge School 10/24/10,2010-10-25T08:15:46Z
inmytree,Pearl Jam - Daughter - Bridge School 10/24/10,2010-10-25T07:59:55Z
inmytree,pearl jam intro + walkon,2010-10-25T07:34:34Z
inmytree,backstagey,2010-10-25T07:31:57Z
inmytree,say hi.,2010-10-25T07:25:59Z
inmytree,time,2007-10-28T04:45:23Z
inmytree,good times,2007-10-28T04:44:50Z
inmytree,so you wanna be a rock n roll star,2007-10-28T04:39:06Z
inmytree,trouble - eddie vedder solo,2007-10-28T04:35:00Z
inmytree,lost cause - beck w/will ferrell,2007-10-28T04:23:21Z
inmytree,chris rock intro @ tsunami benefit,2007-10-28T04:08:31Z
inmytree,morning jacket @ lollapalooza o7,2007-08-10T02:22:27Z
inmytree,hope on a plane,2007-08-10T02:19:02Z
inmytree,neil + peggy young - comes a time,2006-10-24T04:07:43Z
inmytree,pearl jam n' neil young - throw your hatred down @ bridge school 2006,2006-10-24T03:43:29Z
inmytree,nat. american blessing @ bridge school 2006,2006-10-24T03:42:22Z
inmytree,pearl jam + neil young - RITFW (clip),2006-10-24T03:31:49Z
inmytree,foo fighters clip - bridge school 2006,2006-10-24T03:20:43Z
inmytree,pearl jam - crazy mary,2006-10-24T03:15:15Z
inmytree,pearl jam + neil young - clip,2006-10-24T03:00:07Z
inmytree,foo fighters (clip) - bridge school 2006,2006-10-24T02:48:03Z
inmytree,what a waste,2006-07-20T00:44:46Z
inmytree,sad,2006-07-20T00:35:52Z
inmytree,all along the watchtower (end),2006-07-20T00:27:22Z
inmytree,all along the watchtower,2006-07-20T00:17:29Z
inmytree,mike solo,2006-07-18T03:00:23Z
inmytree,driftin,2006-07-18T02:49:54Z
inmytree,last kiss,2006-07-18T02:45:50Z
inmytree,american in me,2006-07-18T02:38:11Z
inmytree,dead man (end),2006-07-18T02:30:56Z
inmytree,deadman,2006-07-18T02:27:11Z
inmytree,last kiss - pj,2006-07-11T06:18:44Z
inmytree,comatose - pj,2006-07-11T06:06:27Z
inmytree,rats - pearl jam,2006-07-11T06:02:25Z
inmytree,reena - sonic youth,2006-07-11T05:59:44Z
inmytree,(end of) man of the hour - ev,2006-07-11T05:57:15Z
inmytree,man of the hour - ev,2006-07-11T05:53:34Z
MrsEtherBunny,WOODPILE ON CNN,2009-04-24T19:13:50Z
MrsEtherBunny,WOODPILE BEST BUY COMMERICAL,2006-11-27T02:08:21Z
MrsEtherBunny,WOODPILE - Unity Summit commerical,2006-11-18T01:31:03Z
MrsEtherBunny,WOODPILE - "IM A WOOD" OFFICIAL VIDEO,2006-11-17T02:25:17Z
SeattleChannel21,Transportation Committee 5/7/2024,2024-05-07T17:41:49Z
SeattleChannel21,brief 050624 Council Briefing 5/6/2024,2024-05-06T23:00:31Z
SeattleChannel21,Mayor presents $1.45 billion Transportation Levy Proposal,2024-05-03T21:07:28Z
SeattleChannel21,PechaKucha: Community-Powered Conversations on the Future of Artificial Intelligence,2024-05-03T20:31:01Z
SeattleChannel21,"Sustainability, City Light, Arts & Culture Committee 5/3/2024",2024-05-03T18:17:20Z
SeattleChannel21,City Inside/Out: In the Balance: Opt-out vote could determine fate of WA Cares Fund,2024-05-02T21:17:30Z
SeattleChannel21,Land Use Committee 5/1/2024,2024-05-02T00:13:55Z
SeattleChannel21,Mayor hosts second community forum for Creating a Safer Seattle,2024-05-01T22:01:09Z
SeattleChannel21,"Finance, Native Communities, and Tribal Governments Committee 5/1/2024",2024-05-01T19:51:40Z
SeattleChannel21,City Council Meeting 4/30/2024,2024-05-01T00:31:17Z
SeattleChannel21,CityStream: Google Tackles Traffic & Kei Trucks Arrive,2024-04-30T16:57:54Z
SeattleChannel21,Japanese Kei trucks are tiny titans of transport,2024-04-30T16:55:14Z
SeattleChannel21,Seattle & Google team up to cut through city's congestion,2024-04-30T16:53:02Z
SeattleChannel21,Council Briefing 4/29/2024,2024-04-29T23:18:05Z
SeattleChannel21,District 7 Town Hall on Creating a Safer Seattle,2024-04-26T19:51:07Z
SeattleChannel21,"Governance, Accountability and Economic Development Committee 4/25/2024",2024-04-26T02:48:31Z
SeattleChannel21,"Libraries, Education & Neighborhoods Committee 4/25/2024",2024-04-25T18:57:05Z
SeattleChannel21,Russian-American Encounters in Seattle,2024-04-25T17:42:53Z
SeattleChannel21,Homes for Some: Seattle's History of Housing and Racial Exclusion,2024-04-25T17:19:59Z
SeattleChannel21,Mediterranean Imprints and Erasures in Seattle: The journey of Sephardic Jews in the PNW,2024-04-25T17:01:07Z
SeattleChannel21,"Art Zone: Seattle on canvas, punchy chocolatier & more",2024-04-25T16:18:29Z
SeattleChannel21,"""Palestinians and Jews Working for Peace"" encapsulates tragedy & hope in art",2024-04-25T16:03:31Z
SeattleChannel21,Chocolatier Margaret Savas packs a punch with her sweet confections,2024-04-25T15:52:11Z
SeattleChannel21,Artist Michael Stasinos paints Seattle¡¯s soul in breathtaking detail,2024-04-25T15:41:01Z
SeattleChannel21,"Parks, Public Utilities & Technology Committee 4/24/24",2024-04-24T22:31:06Z
SeattleChannel21,Housing & Human Services Committee 4/24/2024,2024-04-24T18:59:32Z
SeattleChannel21,Public Safety Committee 4/23/2024,2024-04-24T18:33:31Z
SeattleChannel21,City Council Meeting 4/23/2024,2024-04-24T00:00:19Z
SeattleChannel21,Council Briefing 4/22/2024,2024-04-22T23:31:33Z
SeattleChannel21,Earth stewards clean up Seattle's urban forests,2024-04-22T23:30:37Z
SeattleChannel21,Club helps remote control car enthusiasts unleash their inner speed demons,2024-04-22T18:06:41Z
SeattleChannel21,Exploring Seattle's flora & fauna for Earth Day,2024-04-22T17:52:02Z
SeattleChannel21,Councilmember Morales discusses failed land use bill & more,2024-04-19T22:56:40Z
SeattleChannel21,"Sustainability, City Light, Arts & Culture Committee 4/19/2024",2024-04-19T19:38:05Z
SeattleChannel21,City Inside/Out: Washington voters to decide fate of state's landmark climate policy,2024-04-19T14:15:23Z
SeattleChannel21,Land Use Committee 4/17/2024,2024-04-17T23:57:31Z
SeattleChannel21,Select Budget Committee 4/17/24,2024-04-17T21:45:36Z
SeattleChannel21,Seattle's tunnel vision for cleaner waterways,2024-04-17T18:24:58Z
SeattleChannel21,Bioswales offer natural defense against urban runoff,2024-04-17T17:50:46Z
SeattleChannel21,New climate tax credits spark solar surge in Seattle,2024-04-17T17:47:53Z
SeattleChannel21,Remembering community champion Matt Chan,2024-04-17T17:40:47Z
SeattleChannel21,"CityStream: Tunnels, Bioswales and Rooftop Solar",2024-04-17T15:23:33Z
SeattleChannel21,City Council Meeting 4/16/2024,2024-04-16T22:57:07Z
SeattleChannel21,Book Lust with Nancy Pearl: A very fortunate interview with Daniel Handler (aka Lemony Snicket),2024-04-16T22:51:00Z
SeattleChannel21,Transportation Committee 4/16/2024,2024-04-16T20:22:14Z
SeattleChannel21,"PechaKucha: Future Forward: Innovation, Equity & the Power of Community",2024-04-16T19:30:38Z
SeattleChannel21,Council Briefing 4/15/2024,2024-04-15T22:52:11Z
SeattleChannel21,Mayor announces 2024 One Seattle Day of Service on May 18,2024-04-12T20:37:43Z
SeattleChannel21,"Governance, Accountability & Economic Development Committee 4/11/2024",2024-04-11T23:20:07Z
SeattleChannel21,Seattle-area students take trip of a lifetime to Historic Black Colleges,2024-04-11T18:06:36Z
SeattleChannel21,"Libraries, Education & Neighborhoods Committee 4/11/2024",2024-04-11T17:42:56Z
SeattleChannel21,"Parks, Public Utilities & Technology Committee 4/10/24",2024-04-10T23:42:05Z
SeattleChannel21,Constellations of Kin: Strategies of Belonging for the Snohomish Indian Nation,2024-04-10T23:23:51Z
SeattleChannel21,Housing & Human Services Committee 4/10/2024,2024-04-10T20:00:16Z
SeattleChannel21,City and Citizens: Seattleites and Their Rights,2024-04-10T15:28:15Z
SeattleChannel21,3rd Annual One Seattle Day of Service,2024-04-09T23:20:11Z
SeattleChannel21,City Council Meeting 4/9/2024,2024-04-09T22:45:03Z
SeattleChannel21,Public Safety Committee 4/9/2024,2024-04-09T21:52:19Z
SeattleChannel21,Council Briefing 04/08/24,2024-04-08T22:59:31Z
SeattleChannel21,Economic and Revenue Forecast Council Meeting 04/08/24,2024-04-08T21:28:06Z
SeattleChannel21,"From streets to stanzas, Seattle's neighborhoods host poetry installations",2024-04-08T17:54:51Z
SeattleChannel21,Mayor Harrell signs new labor contracts with City of Seattle employees,2024-04-05T21:32:26Z
SeattleChannel21,Mayor releases Seattle Transportation Levy renewal draft proposal for public input,2024-04-05T20:28:56Z
SeattleChannel21,"Sustainability, City Light, Arts & Culture Committee 4/5/2024",2024-04-05T18:58:15Z
SeattleChannel21,Mayor releases Seattle Transportation Levy renewal draft proposal for public input,2024-04-05T15:55:49Z
SeattleChannel21,"Finance, Native Comm. & Tribal Govts. Mtg. 4/3/24",2024-04-03T19:50:42Z
SeattleChannel21,City Council Meeting 04/02/2024,2024-04-02T23:42:59Z
SeattleChannel21,"International Women's Day: A Fireside Chat with First Lady of Seattle, Joanne Harrell",2024-04-02T23:09:53Z
SeattleChannel21,Mayor & SDOT break ground on East Marginal Way corridor improvements,2024-04-02T21:16:22Z
SeattleChannel21,Transportation Committee 4/2/2024,2024-04-02T19:47:08Z
SeattleChannel21,Council Briefing 4/1/2024,2024-04-02T19:02:15Z
SeattleChannel21,Shayna Egan's passion shines in jewelry creation & restoration,2024-04-01T19:54:31Z
SeattleChannel21,Art Zone with Nancy Guppy 3/28/24,2024-04-01T19:47:50Z
SeattleChannel21,"CityStream: Seattle makers craft & restore furniture, shoes, & more!",2024-04-01T19:41:22Z
SeattleChannel21,Furniture Repair Bank serves the community and the planet,2024-04-01T19:38:07Z
SeattleChannel21,"Governance, Accountability and Economic Development Committee 3/28/2024",2024-03-29T02:03:07Z
SeattleChannel21,"Libraries, Education and Neighborhoods Committee 03/28/2024",2024-03-28T19:36:35Z
SeattleChannel21,Musician Eva Walker sings the alphabet,2024-03-28T19:15:50Z
SeattleChannel21,March 2024: Arts Calendar of Events,2024-03-28T19:14:47Z
SeattleChannel21,Vashon Island serves as the "secret sauce" in unique artist residency,2024-03-28T19:10:55Z
SeattleChannel21,"Fountainhead Gallery, Queen Anne's radiant art haven since 1996",2024-03-28T19:07:49Z
SeattleChannel21,City Inside/Out: New law opens doors for DREAMers to serve in law enforcement,2024-03-28T16:15:29Z
SeattleChannel21,"Parks, Public Utilities & Technology Committee 03/27/24",2024-03-27T23:42:22Z
SeattleChannel21,Housing and Human Services Committee 3/27/2024,2024-03-27T19:44:51Z
SeattleChannel21,Seattle City Council Meeting 03/26/2024,2024-03-26T22:28:49Z
SeattleChannel21,Public Safety Committee 3/26/2024,2024-03-26T20:11:25Z
SeattleChannel21,Council Briefing 3/25/2024,2024-03-26T17:29:46Z
SeattleChannel21,Councilmembers Saka & Woo address rise in gun violence on Council Edition,2024-03-25T16:13:41Z
SeattleChannel21,City Inside/Out: Can Seattle's growth roadmap tackle affordable housing challenge?,2024-03-22T21:57:57Z
SeattleChannel21,Land Use Committee 3/20/2024,2024-03-21T00:37:59Z
SeattleChannel21,Book Lust with Nancy Pearl: Kevin O'Brien's new historic fiction puts WWII-era Seattle on edge,2024-03-20T20:49:28Z
SeattleChannel21,"State of Africatown 2024: Celebrating history, taking action",2024-03-20T19:19:44Z
SeattleChannel21,"Finance, Native Comm. & Tribal Govts. Mtg. 03/20/24",2024-03-20T17:22:13Z
SeattleChannel21,Seattle City Council Meeting 03/19/2024,2024-03-19T22:23:43Z
SeattleChannel21,Leaders celebrate nation's first business community property ownership program,2024-03-19T22:09:37Z
SeattleChannel21,Transportation Committee 3/19/2024,2024-03-19T21:03:19Z
SeattleChannel21,Town Square: State of Downtown 2024: Connection & Community,2024-03-19T19:16:15Z
SeattleChannel21,Council Briefing 3/18/2024,2024-03-19T16:29:19Z
SeattleChannel21,Mayor announces Seattle preschool program expansion,2024-03-18T20:36:01Z
SeattleChannel21,Luck of the Irish brings sun & cheer for annual St. Patrick's Day Parade,2024-03-18T19:39:59Z
SeattleChannel21,"Sustainability, City Light, Arts and Culture Committee 3/15/2024",2024-03-15T18:14:14Z
SeattleChannel21,Mayor holds public forum to discuss Creating a Safer Seattle,2024-03-15T03:47:38Z
SeattleChannel21,"Governance, Accountability & Economic Development Committee 2/14/2024",2024-03-15T00:37:16Z
SeattleChannel21,"From housing to citizen initiatives, inside Olympia's short legislative session",2024-03-14T23:03:15Z
SeattleChannel21,"Libraries, Education & Neighborhoods Committee 03/14/2024",2024-03-14T18:37:27Z
SeattleChannel21,Shaun Scott presents "Heartbreak City",2024-03-14T17:43:35Z
SeattleChannel21,"Parks, Public Utilities & Technology Committee 03/13/24",2024-03-14T00:04:35Z
SeattleChannel21,The inspiring history & legacy of UW women's rowing,2024-03-13T23:34:44Z
SeattleChannel21,Housing & Human Services Mtg. 03/13/2024,2024-03-13T20:59:01Z
SeattleChannel21,"Mayor, Seattle Fire rolls out medication treatment program",2024-03-13T17:45:49Z
SeattleChannel21,"Seattle author Ijeoma Oluo on latest book, ""Be a Revolution,"" and its application in everyday life",2024-03-13T16:55:34Z
SeattleChannel21,Seattle City Council Meeting 03/12/2024,2024-03-12T22:20:14Z
SeattleChannel21,Public Safety Committee 3/12/2024,2024-03-12T20:53:57Z
SeattleChannel21,"CityStream: UW women's rowing, paragliding at Poo Poo Point & more",2024-03-12T20:04:58Z
SeattleChannel21,CityStream: The Arc of King County empowers individuals with developmental disabilities,2024-03-12T19:51:07Z
SeattleChannel21,CityStream: Paraglider with cerebral palsy reclaims the skies thanks to Project Airtime,2024-03-12T19:49:21Z
SeattleChannel21,CityStream: UW women's rowing rises from humble beginnings to national glory,2024-03-12T19:49:08Z
SeattleChannel21,Council Briefing 3/11/2024,2024-03-12T01:22:38Z
SeattleChannel21,Land Use Committee 3/6/2024,2024-03-07T01:07:35Z
SeattleChannel21,Confronting Hate Together: The Power of Community,2024-03-07T00:11:00Z
SeattleChannel21,"Finance, Native Comm. & Tribal Govts. Mtg. 03/06/24",2024-03-06T20:34:18Z
SeattleChannel21,Seattle City Council Meeting 03/05/24,2024-03-06T00:27:51Z
SeattleChannel21,Transportation Committee 3/5/2024,2024-03-05T21:13:04Z
SeattleChannel21,Seattle City Council Briefing 3/4/2024,2024-03-05T00:34:12Z
SeattleChannel21,Untold Stories of Mental Health,2024-03-01T21:59:12Z
SeattleChannel21,Front Row: Bailadores de Bronce,2024-03-01T21:54:12Z
SeattleChannel21,Arundel Books' journey from press publisher to literary hub,2024-03-01T19:37:08Z
SeattleChannel21,Baso Fibonacci illuminates humanity through art,2024-03-01T19:35:29Z
SeattleChannel21,Creatives mark 20 years of turning dream into a reality with Ballard art hub,2024-03-01T19:33:46Z
SeattleChannel21,Painter Liz Tran uses color to activate her 'brain & heart',2024-03-01T19:32:29Z
SeattleChannel21,Remembering Susie Tennant: A guiding light in the Northwest music scene,2024-03-01T19:31:10Z
SeattleChannel21,Art Zone with Nancy Guppy 3/1/24,2024-03-01T19:30:03Z
SeattleChannel21,"Sustainability, City Light, Arts & Culture Committee 3/1/2024",2024-03-01T19:26:07Z
SeattleChannel21,King County's growing homelessness epidemic sparks calls for results & accountability,2024-02-29T15:59:42Z
SeattleChannel21,"Parks, Public Utilities & Technology Committee 2/28/2024",2024-02-29T01:31:29Z
SeattleChannel21,Waterfront project will restore native plants & Salish stories,2024-02-29T00:40:00Z
SeattleChannel21,"CityStream: 50-year Reunions, Cinematic Returns, Baseball, and Black History Month",2024-02-28T22:54:41Z
SeattleChannel21,Housing & Human Services Committee 2/28/2024,2024-02-28T20:15:59Z
SeattleChannel21,"City Council Meeting February 27, 2024",2024-02-28T03:07:13Z
SeattleChannel21,Public Safety Committee 2/27/2024,2024-02-27T22:21:21Z
SeattleChannel21,Town Square: History Caf¨¦: Records of Homelessness,2024-02-27T19:49:25Z
SeattleChannel21,Local author reunites with life-changing Franklin High School teacher,2024-02-27T17:13:59Z
SeattleChannel21,Iconic downtown movie theater makes cinematic return,2024-02-27T17:13:45Z
SeattleChannel21,Seattle City Council Briefing 2/26/2024,2024-02-27T00:05:23Z
SeattleChannel21,"Libraries, Education & Neighborhoods Committee 2/22/2024",2024-02-22T19:39:24Z
SeattleChannel21,"Explore the ""strange subject matter"" of novel ""Dayswork,"" by Jennifer Habel and Chris Bachelder",2024-02-22T17:40:13Z
SeattleChannel21,Land Use Committee 2/21/2024,2024-02-22T04:19:34Z
SeattleChannel21,"Finance, Native Communities and Tribal Governments Committee 2/21/2024",2024-02-21T21:06:07Z
SeattleChannel21,Mayor Bruce Harrell delivers 2024 State of the City address,2024-02-21T00:46:45Z
SeattleChannel21,"City Council Meeting February 20, 2024",2024-02-20T23:50:10Z
SeattleChannel21,Transportation Committee 2/20/2024,2024-02-20T21:16:46Z
SeattleChannel21,Seattle U Conversations: Seattle City Council's six fresh faces,2024-02-17T00:00:39Z
SeattleChannel21,"Sustainability, City Light, Arts and Culture Committee 2/16/2024",2024-02-16T21:36:12Z
SeattleChannel21,"Parks, Public Utilities & Technology Committee 2/14/2024",2024-02-15T01:28:59Z
SeattleChannel21,Housing and Human Services Committee 2/14/2024,2024-02-14T23:34:01Z
SeattleChannel21,City leaders & community members raise Black Liberation Flag over Seattle City Hall,2024-02-14T20:03:59Z
SeattleChannel21,"City Council Meeting February 13, 2024",2024-02-14T00:05:55Z
SeattleChannel21,G¨¹lg¨¹n Kayim is sworn in as director of Seattle's Office of Arts & Culture,2024-02-13T23:54:34Z
SeattleChannel21,Seattle chosen as host city for National Minority Supplier Development Council Business Econ. Forum,2024-02-13T23:02:37Z
SeattleChannel21,Public Safety Committee Agenda 2/13/2024,2024-02-13T21:30:17Z
SeattleChannel21,Seattle City Council Briefing 2/12/2024,2024-02-13T00:19:30Z
SeattleChannel21,Council Edition: Councilmember Woo integrates her cultural heritage into leadership style,2024-02-12T22:24:06Z
SeattleChannel21,City Inside/Out: Washington voters' deepfake dilemma in 2024 elections,2024-02-09T21:06:24Z
SeattleChannel21,Seattle City Council officially recognizes Lunar New Year as citywide holiday,2024-02-09T20:32:12Z
SeattleChannel21,"Governance, Accountability & Economic Development Committee 2/8/2024",2024-02-09T01:27:56Z
SeattleChannel21,"Libraries, Education & Neighborhoods Committee 2/8/2024",2024-02-08T19:41:06Z
SeattleChannel21,Land Use Committee 2/7/2024,2024-02-08T04:04:22Z
SeattleChannel21,"CityStream: Free Medical, Dental & Vision Care Clinic",2024-02-07T23:42:22Z
SeattleChannel21,"City celebrates affordable housing investments, anti-displacement achievements",2024-02-07T23:29:28Z
SeattleChannel21,"Seattle/King County Clinic, where compassion meets healthcare for all",2024-02-07T22:40:36Z
SeattleChannel21,"Volunteers power Seattle/King County Clinic, bridging language gaps & specialties",2024-02-07T21:57:34Z
SeattleChannel21,From diagnosis to action: SKCC's lab tests provide critical insights for patients,2024-02-07T21:54:37Z
SeattleChannel21,Seattle/King County Clinic provides visionary experience with eyecare,2024-02-07T20:50:47Z
SeattleChannel21,The Herculean task of stocking Seattle/King County Clinic's supplies,2024-02-07T20:33:13Z
SeattleChannel21,Seattle IT lends helping hand for annual Seattle/King County Clinic,2024-02-07T20:09:32Z
SeattleChannel21,"From hammer to heel, the story behind Leolo's bespoke shoe craftsmanship",2024-02-07T17:18:45Z
SeattleChannel21,Seattle City Council Meeting 2/6/2024,2024-02-07T00:31:37Z
SeattleChannel21,Transportation Committee 2/6/2024,2024-02-06T21:02:39Z
SeattleChannel21,Seattle City Council Briefing 2/5/2024,2024-02-06T01:33:21Z
SeattleChannel21,"Mayor Harrell, city leaders break ground on Fire Station 31",2024-02-05T21:58:54Z
SeattleChannel21,Town Square: The Seattle Times Pictures of the Year 2023,2024-02-02T00:49:09Z
SeattleChannel21,Seattle City Council Meeting 1/30/2024,2024-01-31T00:50:15Z
SeattleChannel21,"Council Edition: New faces, fresh perspectives, and Position 8 debate",2024-01-30T20:19:28Z
SeattleChannel21,"City of Seattle announces battery ban, highlights fire risk when batteries are thrown in the garbage",2024-01-30T02:06:04Z
SeattleChannel21,Seattle City Council Briefing 1/29/2024,2024-01-30T00:37:42Z
SeattleChannel21,City Inside/Out: Cities are feeling the pressure as lawmakers push for more affordable housing,2024-01-26T23:32:43Z
SeattleChannel21,Mayor Harrell announces FTA funding for new RapidRide J Line,2024-01-26T23:20:47Z
SeattleChannel21,Art Zone: Expect the unexpected at Mini Mart City Park,2024-01-25T23:31:04Z
SeattleChannel21,Art Zone: Iconic Cinerama returns as SIFF Cinema Downtown,2024-01-25T23:26:36Z
SeattleChannel21,Art Zone: Artist¡¯s tribute to Metro's No. 7 bus line celebrates community,2024-01-25T22:33:48Z
SeattleChannel21,"Art Zone with Nancy Guppy: Mini Mart City Park, SIFF Cinema Downtown, No. 7 bus mural & more!",2024-01-25T22:12:54Z
SeattleChannel21,"From science to sizzle, acclaimed chef J. Kenji L¨®pez-Alt shares the art of wok cooking",2024-01-25T18:30:14Z
SeattleChannel21,Mayor Bruce Harrell joins groundbreaking for Waterfront Park improvement project,2024-01-24T22:51:32Z
SeattleChannel21,Councilmember Tanya Woo answers questions after being appointed to fill position 8 vacancy,2024-01-24T01:49:19Z
SeattleChannel21,"City Council Meeting January 23, 2024",2024-01-24T01:10:24Z
SeattleChannel21,"CityStream: Aerial art, Curbside EV charging, New life in retired Georgetown Steam Plant",2024-01-23T22:03:09Z
SeattleChannel21,Renowned sculptor John Grade's suspended splendor in Arboretum,2024-01-23T21:56:36Z
SeattleChannel21,City Light eases electric vehicle concerns with new charging stations,2024-01-23T21:54:25Z
SeattleChannel21,Seattle City Council Special Meeting of 1/22/2024,2024-01-23T21:13:24Z
SeattleChannel21,The Georgetown Steam Plant buzzes with life as an arts and events space,2024-01-23T20:12:16Z
SeattleChannel21,Seattle City Council Briefing 1/22/2024,2024-01-23T01:03:12Z
SeattleChannel21,Community Forum on Council Vacancy Position 8,2024-01-19T05:20:38Z
SeattleChannel21,"Over 1,000 unite for annual MLK Jr. Day March",2024-01-16T23:47:40Z
SeattleChannel21,"City Council Meeting January 16, 2024",2024-01-16T23:36:41Z
SeattleChannel21,City Council Special Meeting 1/12/2024,2024-01-13T00:55:47Z
SeattleChannel21,City Council Special Meeting Executive Session 1/12/2024,2024-01-12T19:56:34Z
SeattleChannel21,Federal grant helps power Seattle's sustainable shift with salvaged wood warehouse,2024-01-11T17:33:25Z
SeattleChannel21,Art Zone celebrates creativity with this look back at memorable stories from 2023,2024-01-10T20:18:31Z
SeattleChannel21,"City Council Meeting January 9, 2024",2024-01-09T23:01:47Z
SeattleChannel21,Seattle City Council Briefing 1/8/2024,2024-01-09T01:33:32Z
SeattleChannel21,Community Stories: We Hereby Refuse: The Akutsu Family Resists,2024-01-08T20:03:31Z
SeattleChannel21,Mayor Harrell recalls UW's underdog triumph in 1978 Rose Bowl,2024-01-06T00:46:20Z
SeattleChannel21,Five fresh faces take oath of office for Seattle City Council,2024-01-04T18:20:33Z
SeattleChannel21,Seattle City Council 1/2/2024,2024-01-03T02:12:50Z
SeattleChannel21,mam's books opens a new chapter for Chinatown-International District,2023-12-22T19:30:07Z
SeattleChannel21,City Inside/Out: Unpacking 2023¡¯s top Seattle stories with seasoned reporters,2023-12-20T16:40:38Z
SeattleChannel21,Book Lust with Nancy Pearl: Daniel James Brown talks about his book "The Boys in the Boat",2023-12-19T01:08:38Z
SeattleChannel21,"In face of challenges, Seattle leaders bet on Dual Dispatch to improve public safety",2023-12-15T22:50:41Z
SeattleChannel21,Mayor Harrell welcomes incoming councilmembers,2023-12-15T22:34:32Z
SeattleChannel21,Jenifer Chao sworn in as director of the Department of Neighborhoods,2023-12-15T21:36:45Z
SeattleChannel21,Outgoing council president Juarez reflects on legacy; North Seattle's future,2023-12-15T20:59:06Z
SeattleChannel21,"Seattle Parks Chief, AP Diaz, champions thriving future for city's parks",2023-12-14T20:16:18Z
SeattleChannel21,Behind the keys: Pianist Billy Stover's passion for nurturing musical talent,2023-12-14T16:48:23Z
SeattleChannel21,Seattle's Chao-Chen Yang's photography takes center stage at Cascadia Art Museum,2023-12-14T16:46:49Z
SeattleChannel21,Art Zone: Selena Kearney's photography explores the weight of cultural appropriation,2023-12-14T16:46:22Z
SeattleChannel21,"Art Zone: Behind lens with Selena Kearney, pianist Billy Stover & more",2023-12-14T16:45:49Z
SeattleChannel21,Mayor Harrell Signs Building Emissions Performance Standard (BEPS) Legislation into Law,2023-12-13T21:37:56Z
SeattleChannel21,Economic and Revenue Forecast Council meeting of 12/13/23,2023-12-13T20:49:34Z
SeattleChannel21,Seattle City Council 12/12/2023,2023-12-13T03:19:46Z
SeattleChannel21,"From Rainier Valley roots to community leader, meet new Office for Civil Rights director",2023-12-12T23:08:27Z
SeattleChannel21,Public Safety & Human Services Committee 12/12/23,2023-12-12T21:22:05Z
SeattleChannel21,Seattle City Council Briefing 12/11/23,2023-12-12T01:46:23Z
SeattleChannel21,Land Use Committee Special Meeting 11/29/23,2023-12-09T00:50:04Z
SeattleChannel21,"Neighborhoods, Education, Civil Rights and Culture Committee 12/8/23",2023-12-08T19:23:05Z
SeattleChannel21,Select Committee on Climate Action 12/7/23,2023-12-07T19:44:02Z
SeattleChannel21,Public Assets & Homelessness Committee 12/6/23,2023-12-07T01:32:57Z
SeattleChannel21,"Mayor, Consul-General of Japan unveil commemorative plaque by cherry blossom trees",2023-12-07T00:17:49Z
SeattleChannel21,City Council 12/5/23,2023-12-06T22:00:27Z
SeattleChannel21,King County's 2023 Behavioral Health Legislative Forum,2023-12-05T23:23:45Z
SeattleChannel21,Committee on Transportation and Seattle Public Utilities 12/5/22,2023-12-05T22:23:04Z
SeattleChannel21,What you should know about lithium-ion batteries,2023-12-05T22:00:18Z
SeattleChannel21,"CityStream: Species Restoration, Battery Safety & Turning Down the Volume",2023-12-05T21:59:39Z
SeattleChannel21,Conservation efforts help revive native Puget Sound shellfish,2023-12-05T21:33:22Z
SeattleChannel21,Seattle City Council Briefing 12/4/23,2023-12-05T00:06:33Z
SeattleChannel21,City Inside/Out: Tukwila church becomes ground zero for asylum seeker crisis,2023-12-01T23:15:19Z
SeattleChannel21,In Search of No-No Boy,2023-12-01T01:24:50Z
SeattleChannel21,Councilmember Lewis reflects back on his term serving District 7,2023-11-30T20:02:45Z
SeattleChannel21,"Select Budget Committee November 30, 2023",2023-11-30T19:34:33Z
SeattleChannel21,Front Row: Jazz In The City's: Jazz=Culture,2023-11-30T18:38:54Z
SeattleChannel21,Seattle City Council Land Use Committee Special Meeting 11/29/23,2023-11-30T02:32:13Z
SeattleChannel21,Video tribute to videographer Tom Speer,2023-11-29T23:05:25Z
SeattleChannel21,Select Committee on Climate Action 11/29/23,2023-11-29T20:40:39Z
SeattleChannel21,Public Safety and Human Services Committee 11/28/23,2023-11-28T19:37:51Z
SeattleChannel21,Council Briefing 11/27/23,2023-11-27T23:14:04Z
SeattleChannel21,Seattle City Council 11/21/23,2023-11-22T07:21:49Z
SeattleChannel21,The Postwar Seattle Chinatown of John Okada,2023-11-21T23:30:55Z
SeattleChannel21,Seattle Park District Board Meeting 11/20/23,2023-11-20T20:56:13Z
SeattleChannel21,Select Budget Committee 11/20/23,2023-11-20T18:42:35Z
SeattleChannel21,"Seattle receives $4M grant for solid waste infrastructure, environmental sustainability efforts",2023-11-16T23:35:35Z
SeattleChannel21,Seattle City Council Select Budget Committee 11/15/23 Session II,2023-11-16T01:44:16Z
SeattleChannel21,Seattle City Council Select Budget Committee 11/15/23 Session I,2023-11-15T21:12:37Z
SeattleChannel21,"Select Budget Committee November 14, 2023 Session II",2023-11-15T03:37:18Z
SeattleChannel21,CityStream: Alyssa London¡¯s Culture Story,2023-11-15T01:19:53Z
SeattleChannel21,CityStream: New Fred Hutch Addition Puts Patients First,2023-11-15T01:19:27Z
SeattleChannel21,"CityStream: Culture Story, Relics Returned & Considerate Care",2023-11-15T01:19:15Z
SeattleChannel21,Seattle City Council Select Budget Committee 11/14/2023 Session I,2023-11-14T22:52:53Z
SeattleChannel21,Seattle City Council Select Budget Committee Public Hearing 11/13/23,2023-11-14T22:27:33Z
SeattleChannel21,Seattle City Council Select Budget Committee 11/13/23 Session II,2023-11-14T01:18:54Z
SeattleChannel21,"Seattle City Council Select Budget Committee November 12, 2023 Session I",2023-11-13T22:15:26Z
SeattleChannel21,City Inside/Out: Are Seattle's politics shifting? Experts weigh in on early vote count.,2023-11-09T23:43:51Z
SeattleChannel21,"Art Zone takes flight with glass artist Cappy Thompson, Seattle Rep & more",2023-11-09T20:45:56Z
SeattleChannel21,Conservationist Chris Maynard's intricate avian art,2023-11-09T20:43:18Z
SeattleChannel21,Stories in glass & grisaille: The rich artistic world of Cappy Thompson,2023-11-09T20:38:57Z
SeattleChannel21,From page to stage: Seattle Rep's 'Little Women' costume creations,2023-11-09T20:35:21Z
SeattleChannel21,"Museum of Flight exhibit soars with the awe, joy & love of flight",2023-11-09T20:34:03Z
SeattleChannel21,Art Zone celebrates the life & legacy of Jen¨¢ Cane,2023-11-09T20:25:20Z
SeattleChannel21,City Council 11/7/23,2023-11-08T04:19:48Z
SeattleChannel21,Seattle University Conversations: Exploring the nexus of mental health & politics,2023-11-03T16:19:59Z
SeattleChannel21,Mayor Harrell signs new Executive Order to expand contracting equity with the City,2023-11-01T22:28:24Z
SeattleChannel21,"Author and Illustrator Josh Tuininga discusses new graphic novel, ¡°We Are Not Strangers¡±",2023-11-01T00:17:23Z
SeattleChannel21,Scarecrow Video celebrates 35 years of movie magic,2023-10-31T21:17:02Z
SeattleChannel21,"Calvary Cemetery, where Seattle's prominent figures rest & history lives on",2023-10-31T20:53:15Z
SeattleChannel21,"CityStream: FBI 101, Traveling Judge & Scarecrow Video",2023-10-31T20:50:12Z
SeattleChannel21,FBI's citizens academy gives public inside look into America's top law enforcement agency,2023-10-31T20:36:24Z
SeattleChannel21,Select Budget Committee 10/27/23 Session II,2023-10-28T04:25:04Z
SeattleChannel21,"Select Budget Committee October 27, 2023 Session I",2023-10-27T22:29:00Z
SeattleChannel21,Councilmembers Herbold & Mosqueda dive into city's budget challenges on Council Edition,2023-10-27T20:02:44Z
SeattleChannel21,The Fight Against Fentanyl,2023-10-27T18:07:35Z
SeattleChannel21,"Meet Tanya Kim, director of the Seattle Human Services Department",2023-10-27T00:42:02Z
SeattleChannel21,City launches CARE dual dispatch behavioral health response pilot,2023-10-25T20:36:35Z
SeattleChannel21,Seattle City Council 10/24/2023,2023-10-24T22:36:03Z
SeattleChannel21,"Georgetown Morgue, giving more than just thrills & chills since 2009",2023-10-24T21:20:52Z
SeattleChannel21,Select Budget Committee 10/20/23,2023-10-21T02:05:46Z
SeattleChannel21,Land Use Committee Special Meeting 10/20/23,2023-10-20T18:37:45Z
SeattleChannel21,District 4 election pits tech entrepreneur Ron Davis against public servant Maritza Rivera,2023-10-19T18:44:00Z
SeattleChannel21,Marshall Foster sworn in as director of Seattle Center,2023-10-19T17:40:59Z
SeattleChannel21,Cristina Garc¨ªa's new novel picks up where ¡°Dreaming in Cuban¡± left off,2023-10-19T17:01:52Z
SeattleChannel21,Seattle City Council Select Budget Committee - Public Hearing 10/18/23,2023-10-19T05:18:10Z
SeattleChannel21,Local businesses get boost from Seattle's Downtown Activation Plan,2023-10-18T15:30:24Z
SeattleChannel21,"Ben Gitenstein, candidate for Seattle School District No. 1, Director District No. 3",2023-10-17T23:36:42Z
SeattleChannel21,"Evan Briggs, candidate for Seattle School District No. 1, Director District No. 3",2023-10-17T23:36:01Z
SeattleChannel21,"Seattle School District No. 1, Director District No. 3",2023-10-17T23:35:16Z
SeattleChannel21,"Lisa Rivera Smith, candidate for Seattle School District No. 1, Director District No. 2",2023-10-17T23:28:31Z
SeattleChannel21,"Seattle School District No. 1, Director District No. 2",2023-10-17T23:26:21Z
SeattleChannel21,"Seattle School District No. 1, Director District No. 6",2023-10-17T23:24:08Z
SeattleChannel21,"Debbie Carlsen, candidate for Seattle School District No. 1, Director District No. 1",2023-10-17T23:23:50Z
SeattleChannel21,"Gina Topp, candidate for Seattle School District No. 1, Director District No. 6",2023-10-17T23:23:23Z
SeattleChannel21,"Liza Rankin, candidate for Seattle School District No. 1, Director District No. 1",2023-10-17T23:20:33Z
SeattleChannel21,D6 candidates Hanning and Strauss square off on City Inside/Out,2023-10-17T23:13:25Z
SeattleChannel21,"Seattle School District No. 1, Director District No. 1",2023-10-17T23:05:42Z
SeattleChannel21,"Bob Kettle, candidate for City of Seattle, Council District 7",2023-10-17T22:59:40Z
SeattleChannel21,"Andrew J. Lewis, candidate for City of Seattle, Council District 7",2023-10-17T22:56:20Z
SeattleChannel21,"Candidates for City of Seattle, Council District 1",2023-10-17T22:47:27Z
SeattleChannel21,"Tanya Woo, candidate for City of Seattle, Council District 2",2023-10-17T22:45:56Z
SeattleChannel21,"Tammy J. Morales, candidate for City of Seattle, Council District 2",2023-10-17T22:45:09Z
SeattleChannel21,"Candidates for City of Seattle, Council District 2",2023-10-17T22:44:32Z
SeattleChannel21,"Rob Saka, candidate for City of Seattle, Council District 1",2023-10-17T22:43:56Z
SeattleChannel21,"Candidates for City of Seattle, Council District 7",2023-10-17T22:43:42Z
SeattleChannel21,"Maren Costa, candidate for City of Seattle, Council District 1",2023-10-17T22:43:25Z
SeattleChannel21,"Candidates for City of Seattle, Council District 3",2023-10-17T22:42:34Z
SeattleChannel21,"Joy Hollingsworth, candidate for City of Seattle, Council District 3",2023-10-17T22:41:44Z
SeattleChannel21,Video Voters¡¯ Guide General Election 2023 - City of Seattle & Seattle Public Schools,2023-10-17T22:40:01Z
SeattleChannel21,"City of Seattle, Proposition No. 1, Property Tax Levy Renewal for Affordable Housing",2023-10-17T22:38:53Z
SeattleChannel21,"Sofia Aragon, candidate for Metropolitan King County, Council District No. 8",2023-10-17T22:38:07Z
SeattleChannel21,"Teresa Mosqueda, candidate for Metropolitan King County, Council District No. 8",2023-10-17T22:37:53Z
SeattleChannel21,"Jorge L. Bar¨®n, candidate for Metropolitan King County, Council District No. 4",2023-10-17T22:37:31Z
SeattleChannel21,"Sarah Reyneveld, candidate for Metropolitan King County, Council District No. 4",2023-10-17T22:37:12Z
SeattleChannel21,"Metropolitan King County, Council District No. 4",2023-10-17T22:37:00Z
SeattleChannel21,"Metropolitan King County, Council District No. 8",2023-10-17T22:36:42Z
SeattleChannel21,"Doug Basler, candidate for King County, Director of Elections",2023-10-17T22:36:17Z
SeattleChannel21,"Julie Wise, candidate for King County, Director of Elections",2023-10-17T22:35:58Z
SeattleChannel21,"King County, Director of Elections",2023-10-17T22:35:35Z
SeattleChannel21,Video Voters¡¯ Guide General Election 2023 - King County,2023-10-17T22:34:58Z
SeattleChannel21,"Jesse Tam, candidate for Port of Seattle, Commissioner Position 5",2023-10-17T22:34:19Z
SeattleChannel21,"Fred Felleman, candidate for Port of Seattle, Commissioner Position 5",2023-10-17T22:34:07Z
SeattleChannel21,"Pete Hanning, candidate for City of Seattle, Council District 6",2023-10-17T22:33:52Z
SeattleChannel21,"Candidates for Port of Seattle, Commissioner Position 5",2023-10-17T22:33:40Z
SeattleChannel21,"Dan Strauss, candidate for City of Seattle, Council District 6",2023-10-17T22:28:38Z
SeattleChannel21,"Candidates for City of Seattle, Council District 6",2023-10-17T22:24:52Z
SeattleChannel21,"ChrisTiana ObeySumner, candidate for City of Seattle, Council District 5",2023-10-17T22:20:42Z
SeattleChannel21,"Cathy Moore, candidate for City of Seattle, Council District 5",2023-10-17T22:17:16Z
SeattleChannel21,"Maritza Rivera, candidate for City of Seattle, Council District 4",2023-10-17T22:05:31Z
SeattleChannel21,"Candidates for City of Seattle, Council District 4",2023-10-17T22:02:06Z
SeattleChannel21,"Candidates for City of Seattle, Council District 5",2023-10-17T22:01:46Z
SeattleChannel21,"Ron Davis, candidate for City of Seattle, Council District 4",2023-10-17T22:01:09Z
SeattleChannel21,Economic and Revenue Forecast Council meeting of 10/17/23,2023-10-17T19:55:14Z
SeattleChannel21,Seattle Park District Board Public Hearing - 10/16/23,2023-10-17T01:45:18Z
SeattleChannel21,Day of Remembrance for Gun Violence Victims,2023-10-17T00:05:54Z
SeattleChannel21,Seattle City Council Select Budget Committee 10/16/23,2023-10-16T21:03:33Z
SeattleChannel21,"Alex Hudson, candidate for City of Seattle, Council District 3",2023-10-16T19:44:14Z
SeattleChannel21,Seattle Channel Live - City Live,2023-10-16T14:11:42Z
SeattleChannel21,Select Budget Committee 10/13/23 Session II,2023-10-14T01:11:33Z
SeattleChannel21,Fresh faces vie to lead North Seattle's District 5,2023-10-14T01:00:23Z
SeattleChannel21,"Select Budget Committee October 13, 2023 Session I",2023-10-13T22:46:17Z
SeattleChannel21,Seattle City Council District 7 incumbent faces tough challenge from retired naval officer,2023-10-13T20:27:36Z
SeattleChannel21,Seattle City Council Select Budget Committee 10/12/23 Session II,2023-10-13T01:15:20Z
SeattleChannel21,Seattle City Council Select Budget Committee 10/12/23 Session I,2023-10-12T21:04:10Z
SeattleChannel21,"Art Zone: Wynia Lang's visual delights, publication shines spotlight on PNW artists & more",2023-10-12T17:51:50Z
SeattleChannel21,PublicDisplay.ART fills a void in Pacific Northwest's arts media landscape,2023-10-12T17:49:00Z
SeattleChannel21,Wynia Lang's latest work explores process & pattern,2023-10-12T17:45:00Z
SeattleChannel21,Kara Glosova's new exhibit plumbs the depths of human subconsciousness,2023-10-12T17:42:39Z
SeattleChannel21,Four must-see arts picks for your fall calendar,2023-10-12T17:40:45Z
SeattleChannel21,"Seattle City Council Select Budget Committee October 11, 2023 Session II",2023-10-12T01:00:08Z
SeattleChannel21,Seattle's iconic Jazz Alley,2023-10-11T21:15:08Z
SeattleChannel21,"Seattle City Council Select Budget Committee October 11, 2023 - Session 1",2023-10-11T21:08:40Z
SeattleChannel21,Mayor signs legislation to advance Downtown Activation Plan priorities,2023-10-11T20:41:35Z
SeattleChannel21,City Council 10/10/2023,2023-10-11T01:13:38Z
SeattleChannel21,City Inside/Out: Morales & Woo square off to represent Seattle's diverse District 2,2023-10-10T20:58:15Z
SeattleChannel21,Indigenous Peoples' Day 2023: Honoring our Elders: Past and Present,2023-10-09T22:54:30Z
SeattleChannel21,"Fashionista rolls into spotlight & tattoo parlor talk on latest Thank You, MS PAM",2023-10-06T22:00:29Z
SeattleChannel21,"Mayor Harrell, SDOT celebrate groundbreaking of the MLK Jr Way S Safety Project",2023-10-06T21:18:13Z
SeattleChannel21,Mayor Harrell signs new Seattle Tourism Improvement Area legislation,2023-10-04T20:55:33Z
SeattleChannel21,Parenting While Queer: 2SLGBTQ+ Parents & Allies Take Action,2023-10-04T20:32:47Z
SeattleChannel21,Inspire Washington's King County Council Cultural Candidate Forum: Convening Around the Arts,2023-10-03T23:08:02Z
SeattleChannel21,The John Okada Centennial: A celebration of his life and work,2023-09-28T22:59:29Z
SeattleChannel21,Seattle City Council Select Budget Committee 9/27/2023,2023-09-27T22:54:16Z
SeattleChannel21,City Council 9/26/23,2023-09-27T01:33:54Z
SeattleChannel21,Public Safety and Human Services Committee Meeting 9/26/23,2023-09-26T21:59:23Z
SeattleChannel21,Mayor Harrell shares his 2024 budget proposal,2023-09-26T21:16:12Z
SeattleChannel21,Cannabis entrepreneur faces off against transportation activist in District 3 battle,2023-09-26T16:07:50Z
SeattleChannel21,Dr. Elizabeth "Dori" Tunstall:  Antiracist Design,2023-09-25T21:00:07Z
SeattleChannel21,Rev. Ben McBride with Marcus Harrison Green: Radical Belonging,2023-09-22T23:06:39Z
SeattleChannel21,"Neighborhoods, Education, Civil Rights and Culture Committee 9/22/23",2023-09-22T20:50:58Z
SeattleChannel21,Seattle's District 1 council seat up for grabs as newcomers Costa & Saka clash in debate,2023-09-22T20:33:45Z
SeattleChannel21,"Mayor Harrell announces CARE, Seattle¡¯s New Public Safety Department",2023-09-21T23:55:41Z
SeattleChannel21,City Inside/Out: Council Edition with Councilmember Sara Nelson,2023-09-21T23:52:01Z
SeattleChannel21,Seattle Metro Chamber's 141st Annual Meeting: Vision and Opportunity,2023-09-21T21:23:05Z
SeattleChannel21,"Committee on Governance, Native Communities and Tribal Governments 9/21/23",2023-09-21T18:51:30Z
SeattleChannel21,Public Assets & Homelessness Committee 9/20/23,2023-09-21T01:08:03Z
SeattleChannel21,From solo novel to trilogy: Julie Schumacher delves into "The English Experience" with Nancy Pearl,2023-09-20T23:16:16Z
SeattleChannel21,"Committee on Finance and Housing, Sept. 20, 2022",2023-09-20T21:16:53Z
SeattleChannel21,Seattle City Council 9/19/23,2023-09-20T03:46:43Z
SeattleChannel21,Seattle City Council Transportation & Seattle Public Utilities Committee 9/19/23,2023-09-19T21:30:45Z
SeattleChannel21,City provides update on Seattle Fires post-overdose response team pilot,2023-09-19T20:51:45Z
SeattleChannel21,Seattle City Council Briefing 9/18/23,2023-09-19T03:24:20Z
SeattleChannel21,"Meet Rico Quirindongo, Director of Office of Planning & Community Development",2023-09-18T20:11:23Z
SeattleChannel21,Land Use Committee 9/18/23,2023-09-18T19:11:45Z
SeattleChannel21,"Art Zone: Bill Traver & the Traver Gallery, championing local artists since 1977",2023-09-14T21:28:22Z
SeattleChannel21,Seattle City Council Finance & Housing Committee 9/14/23,2023-09-14T21:26:36Z
SeattleChannel21,Art Zone with Nancy Guppy: 9/15/2023,2023-09-14T21:20:34Z
SeattleChannel21,Art Zone: Sarah Norsworthy opens ¡°Written in Water¡± at studio e gallery,2023-09-14T20:00:00Z
SeattleChannel21,Art Zone: Summer 2023 highlight: THING Festival,2023-09-14T19:55:54Z
SeattleChannel21,Art Zone: Seattle Tattoo Expo 2023 highlights,2023-09-14T19:47:00Z
SeattleChannel21,Land Use Committee Public Hearing 9/13/23,2023-09-14T02:48:11Z
SeattleChannel21,"Seattle City Council Economic Development, Technology & City Light Committee Public Hearing 9/13/23",2023-09-13T19:51:31Z
SeattleChannel21,Seattle City Council 9/12/23,2023-09-12T22:32:21Z
SeattleChannel21,Seattle City Council Public Safety and Human Services Committee Special Meeting 9/12/23,2023-09-12T22:24:15Z
SeattleChannel21,"Pinks, the smallest of the five species of Pacific salmon, return to spawn in local rivers",2023-09-12T20:52:27Z
SeattleChannel21,Seattle City Council Briefing 9/11/23,2023-09-11T23:28:26Z
SeattleChannel21,"Seattle City Council Economic Development, Technology & City Light Committee 9/11/23",2023-09-11T18:05:54Z
SeattleChannel21,2023 Mayor¡¯s Public Policy Fellows presentations,2023-09-06T22:05:36Z
SeattleChannel21,Seattle City Council 9/5/23,2023-09-05T23:03:52Z
SeattleChannel21,Seattle City Council Transportation & Seattle Public Utilities Committee 9/5/23,2023-09-05T19:31:12Z
SeattleChannel21,"CityStream: Trees, Bees & Bumbershoot",2023-08-29T16:32:21Z
SeattleChannel21,CityStream: New Northwest Syrup Source,2023-08-29T16:16:36Z
SeattleChannel21,CityStream: Protecting Seattle¡¯s tree canopy,2023-08-29T16:11:14Z
SeattleChannel21,CityStream: What¡¯s All the Buzz About Bees?,2023-08-29T15:46:04Z
SeattleChannel21,Council Edition: Herbold & Lewis discuss possible new drug use legislation,2023-08-21T18:22:09Z
SeattleChannel21,Book Lust: The weird & wonderful short stories of Julianna Baggott,2023-08-17T18:44:22Z
SeattleChannel21,Seattle City Council Public Assets & Homelessness Committee 8/16/23,2023-08-17T00:12:05Z
SeattleChannel21,Seattle Youth Employment Program marks 50 years of empowering tomorrow's leaders,2023-08-16T15:42:41Z
SeattleChannel21,Seattle City Council 8/15/23,2023-08-16T00:09:15Z
SeattleChannel21,Move & groove into the night at Dancing til Dusk,2023-08-15T21:35:43Z
SeattleChannel21,Committee on Transportation and Seattle Public Utilities 8/15/22,2023-08-15T20:36:14Z
SeattleChannel21,Seattle City Council Public Safety & Human Services Committee Special Meeting 8/14/23,2023-08-15T02:26:04Z
SeattleChannel21,Community Police Commission Executive Director Candidate Forum,2023-08-11T20:47:17Z
SeattleChannel21,City of Seattle Economic and Revenue Forecast Council meeting of 8/10/23,2023-08-11T00:00:33Z
SeattleChannel21,Finance and Housing Committee 8/10/23,2023-08-10T20:14:16Z
SeattleChannel21,Acclaimed singer-songwriter Courtney Marie Andrews takes center stage at City Hall Plaza,2023-08-10T00:12:14Z
SeattleChannel21,"Committee on Economic Development, Technology, and City Light 8/9/23",2023-08-09T19:43:55Z
SeattleChannel21,Seattle City Council Special Joint Meeting with the Select Labor Committee - Public Hearing 8/8/23,2023-08-09T02:10:06Z
SeattleChannel21,Seattle City Council 8/8/23,2023-08-09T01:34:13Z
SeattleChannel21,Seattle City Council Public Safety and Human Services Committee Meeting 8/8/23,2023-08-08T21:37:04Z
SeattleChannel21,CityStream: Extended Allergy Season & Lifesaving Lessons,2023-08-08T20:32:28Z
SeattleChannel21,Climate change is extending ¡ª and intensifying ¡ª allergy season in Seattle,2023-08-08T20:09:18Z
SeattleChannel21,"From heartbreak to hope, mother's mission aims to prevent childhood drownings",2023-08-08T20:07:59Z
SeattleChannel21,Seattle City Council Briefing 8/7/23,2023-08-07T23:39:18Z
SeattleChannel21,"Committee on Governance, Native Communities and Tribal Governments 8/3/23",2023-08-03T21:16:04Z
SeattleChannel21,Public Assets & Homelessness Committee - 8/2/23,2023-08-03T00:39:35Z
SeattleChannel21,Seattle City Council Finance & Housing Committee 8/2/23,2023-08-02T22:03:25Z
SeattleChannel21,Seattle City Council meeting 8/1/2023,2023-08-02T18:24:00Z
SeattleChannel21,Committee on Transportation and Seattle Public Utilities 8/1/23,2023-08-01T19:56:57Z
SeattleChannel21,Vanishing Seattle celebrates city's past through captivating collection of salvaged signs,2023-07-28T21:35:42Z
SeattleChannel21,"Committee on Economic Development, Technology, and City Light 7/12/23",2023-07-26T20:28:51Z
SeattleChannel21,Departing Council President Debora Juarez reflects on career highlights,2023-07-26T17:32:05Z
SeattleChannel21,Seattle City Council 7/25/23,2023-07-26T01:01:05Z
SeattleChannel21,Seattle City Council Public Safety and Human Services Committee Meeting 7/25/23,2023-07-25T21:22:25Z
SeattleChannel21,Mayor signs legislation strengthening maritime and industrial protections,2023-07-25T19:49:30Z
SeattleChannel21,"CityStream: Coyotes in the City, Saving Orcas & Return of the Herring",2023-07-24T22:52:45Z
SeattleChannel21,CityStream: Turning Down the Volume to Help Endangered Orcas,2023-07-24T22:21:09Z
SeattleChannel21,"CityStream: A look at Seattle's other city dweller, the coyote",2023-07-24T22:20:16Z
SeattleChannel21,CityStream: Are Herring Runs Rebounding?,2023-07-24T22:19:15Z
SeattleChannel21,Sustainability and Renters' Rights Committee 7/21/23,2023-07-21T21:48:25Z
SeattleChannel21,"Committee on Governance, Native Communities and Tribal Governments 7/20/23",2023-07-20T21:12:02Z
SeattleChannel21,Bon Odori: Sights & sounds from one of Seattle's oldest festivals,2023-07-20T17:50:26Z
SeattleChannel21,Seattle City Council Public Assets and Homelessness Committee 7/19/23,2023-07-20T00:58:06Z
SeattleChannel21,Seattle City Council Finance & Housing Committee 7/19/23,2023-07-19T21:14:39Z
SeattleChannel21,Seattle City Council meeting 7/18/23,2023-07-19T00:29:37Z
SeattleChannel21,Mayor Harrell honors Centering Art & Racial Equity (C.A.R.E.) grant awardees,2023-07-18T23:22:49Z
SeattleChannel21,Committee on Transportation and Seattle Public Utilities 7/18/22,2023-07-18T19:51:44Z
SeattleChannel21,Seattle City Council Briefing 7/17/23,2023-07-17T22:53:03Z
SeattleChannel21,Public Safety & Human Services Committee Special Meeting 7/17/23,2023-07-17T18:38:41Z
SeattleChannel21,"Seattle's Sister Cities: Nantes, France",2023-07-14T17:33:54Z
SeattleChannel21,"Neighborhoods, Education, Civil Rights and Culture Committee 7/14/23",2023-07-14T17:33:34Z
SeattleChannel21,"Councilmember Sawant, community members discuss proposed rent control legislation",2023-07-13T21:03:55Z
SeattleChannel21,Mayor announces new efforts to support an affordable Seattle; connect residents with City services,2023-07-13T17:27:41Z
SeattleChannel21,Seattle City Council Sustainability & Renters' Rights Committee  Public Hearing 7/12/23,2023-07-13T05:34:13Z
SeattleChannel21,Massy Ferguson performs "Fire of Life" during Downtown Summer Sounds,2023-07-12T22:51:43Z
SeattleChannel21,"Committee on Economic Development, Technology, and City Light 7/12/23",2023-07-12T19:21:07Z
SeattleChannel21,AP Diaz sworn in as Superintendent of Seattle Parks and Recreation,2023-07-12T19:20:51Z
SeattleChannel21,Rico Quirindongo sworn in as director of Office of Planning & Community Development,2023-07-12T19:16:30Z
SeattleChannel21,"Seattle School District No. 1, Director District No. 3",2023-07-12T15:00:05Z
SeattleChannel21,"Teresa Mosqueda, candidate for Metropolitan King County, Council District No. 8",2023-07-12T13:00:57Z
SeattleChannel21,"Joy Hollingsworth, candidate for City of Seattle, Council District 3",2023-07-12T13:00:56Z
SeattleChannel21,"Olga Sagan, candidate for City of Seattle, Council District 7",2023-07-12T13:00:50Z
SeattleChannel21,"Efrain Hudnell, candidate for City of Seattle, Council District 3",2023-07-12T13:00:50Z
SeattleChannel21,"Ron Davis, candidate for City of Seattle, Council District 4",2023-07-12T13:00:48Z
SeattleChannel21,"Candidates for Port of Seattle, Commissioner Position 5",2023-07-12T13:00:47Z
SeattleChannel21,"Justin Simmons, candidate for City of Seattle, Council District 5",2023-07-12T13:00:47Z
SeattleChannel21,"Candidates for City of Seattle, Council District 6",2023-07-12T13:00:46Z
SeattleChannel21,"Rob Saka, candidate for City of Seattle, Council District 1",2023-07-12T13:00:46Z
SeattleChannel21,"Jon Lisbin, candidate for City of Seattle, Council District 6",2023-07-12T13:00:44Z
SeattleChannel21,"Boegart Bibby, candidate for City of Seattle, Council District 5",2023-07-12T13:00:42Z
SeattleChannel21,"Dale Kutzera, candidate for City of Seattle, Council District 6",2023-07-12T13:00:41Z
SeattleChannel21,"Dan Strauss, candidate for City of Seattle, Council District 6",2023-07-12T13:00:41Z
SeattleChannel21,"Tye Reed, candidate for City of Seattle, Council District 5",2023-07-12T13:00:39Z
SeattleChannel21,"Jesse Tam, candidate for Port of Seattle, Commissioner Position 5",2023-07-12T13:00:38Z
SeattleChannel21,"Seattle School District No. 1, Director District No. 6",2023-07-12T13:00:38Z
SeattleChannel21,"Tanya Woo, candidate for City of Seattle, Council District 2",2023-07-12T13:00:37Z
SeattleChannel21,"Andrew J. Lewis, candidate for City of Seattle, Council District 7",2023-07-12T13:00:37Z
SeattleChannel21,"Ben Gitenstein, candidate for Seattle School District No. 1, Director District No. 3",2023-07-12T13:00:36Z
SeattleChannel21,"Fred Felleman, candidate for Port of Seattle, Commissioner Position 5",2023-07-12T13:00:36Z
SeattleChannel21,"Cathy Moore, candidate for City of Seattle, Council District 5",2023-07-12T13:00:34Z
SeattleChannel21,"Shobhit Agarwal, candidate for City of Seattle, Council District 3",2023-07-12T13:00:33Z
SeattleChannel21,"Shane Macomber, candidate for City of Seattle, Council District 5",2023-07-12T13:00:33Z
SeattleChannel21,"ChrisTiana ObeySumner, candidate for City of Seattle, Council District 5",2023-07-12T13:00:31Z
SeattleChannel21,"Ken Wilson, candidate for City of Seattle, Council District 4",2023-07-12T13:00:31Z
SeattleChannel21,"Liza Rankin, candidate for Seattle School District No. 1, Director District No. 1",2023-07-12T13:00:30Z
SeattleChannel21,"Bobby J. Tucker, candidate for City of Seattle, Council District 5",2023-07-12T13:00:27Z
SeattleChannel21,"Victoria Palmer, candidate for City of Seattle, Council District 6",2023-07-12T13:00:24Z
SeattleChannel21,"Seattle School District No. 1, Director District No. 1",2023-07-12T13:00:23Z
SeattleChannel21,"Bob Kettle, candidate for City of Seattle, Council District 7",2023-07-12T13:00:22Z
SeattleChannel21,"Margaret Elisabeth, candidate for City of Seattle, Council District 2",2023-07-12T13:00:21Z
SeattleChannel21,"Pete Hanning, candidate for City of Seattle, Council District 6",2023-07-12T13:00:21Z
SeattleChannel21,"Candidates for City of Seattle, Council District 2",2023-07-12T13:00:21Z
SeattleChannel21,"Maren Costa, candidate for City of Seattle, Council District 1",2023-07-12T13:00:20Z
SeattleChannel21,"Sarah Reyneveld, candidate for Metropolitan King County, Council District No. 4",2023-07-12T13:00:20Z
SeattleChannel21,"Candidates for City of Seattle, Council District 7",2023-07-12T13:00:19Z
SeattleChannel21,"Jorge L. Bar¨®n, candidate for Metropolitan King County, Council District No. 4",2023-07-12T13:00:19Z
SeattleChannel21,"Candidates for City of Seattle, Council District 3",2023-07-12T13:00:19Z
SeattleChannel21,"Metropolitan King County, Council District No. 4",2023-07-12T13:00:17Z
SeattleChannel21,"Mia Jacobson, candidate for City of Seattle, Council District 1",2023-07-12T13:00:16Z
SeattleChannel21,Video Voters¡¯ Guide Primary Election 2023 - King County,2023-07-12T13:00:16Z
SeattleChannel21,"George Artem, candidate for City of Seattle, Council District 4",2023-07-12T13:00:16Z
SeattleChannel21,"Alex Cooley, candidate for City of Seattle, Council District 3",2023-07-12T13:00:15Z
SeattleChannel21,"Maritza Rivera, candidate for City of Seattle, Council District 4",2023-07-12T13:00:15Z
SeattleChannel21,"Becka Johnson Poppe, candidate for Metropolitan King County, Council District No. 4",2023-07-12T13:00:15Z
SeattleChannel21,"Metropolitan King County, Council District No. 8",2023-07-12T13:00:13Z
SeattleChannel21,"Candidates for City of Seattle, Council District 1",2023-07-12T13:00:13Z
SeattleChannel21,"Candidates for City of Seattle, Council District 4",2023-07-12T13:00:13Z
SeattleChannel21,"Debbie Carlsen, candidate for Seattle School District No. 1, Director District No. 1",2023-07-12T13:00:12Z
SeattleChannel21,"Lucca Murdoch Howard, candidate for City of Seattle, Council District 5",2023-07-12T13:00:12Z
SeattleChannel21,"Jean Iannelli Craciun, candidate for City of Seattle, Council District 1",2023-07-12T13:00:12Z
SeattleChannel21,"Nilu Jenks, candidate for City of Seattle, Council District 5",2023-07-12T13:00:11Z
SeattleChannel21,"Gina Topp, candidate for Seattle School District No. 1, Director District No. 6",2023-07-12T13:00:10Z
SeattleChannel21,"Candidates for City of Seattle, Council District 5",2023-07-12T13:00:09Z
SeattleChannel21,"Isabelle Kerner, candidate for City of Seattle, Council District 7",2023-07-12T13:00:09Z
SeattleChannel21,"Andrew Ashiofu, candidate for City of Seattle, Council District 3",2023-07-12T13:00:07Z
SeattleChannel21,"Tammy J. Morales, candidate for City of Seattle, Council District 2",2023-07-12T13:00:06Z
SeattleChannel21,Video Voters¡¯ Guide Primary Election 2023 - City of Seattle & Seattle Public Schools,2023-07-12T13:00:06Z
SeattleChannel21,"Alex Hudson, candidate for City of Seattle, Council District 3",2023-07-12T13:00:06Z
SeattleChannel21,"Ry Armstrong, candidate for City of Seattle, Council District 3",2023-07-12T13:00:04Z
SeattleChannel21,"Phil Tavel, candidate for City of Seattle, Council District 1",2023-07-12T13:00:03Z
SeattleChannel21,"Christie Robertson, candidate for Seattle School District No. 1, Director District No. 3",2023-07-12T13:00:03Z
SeattleChannel21,"Sofia Aragon, candidate for Metropolitan King County, Council District No. 8",2023-07-12T13:00:03Z
SeattleChannel21,"Evan Briggs, candidate for Seattle School District No. 1, Director District No. 3",2023-07-12T13:00:02Z
SeattleChannel21,"Lucy Barefoot, candidate for City of Seattle, Council District 1",2023-07-12T13:00:02Z
SeattleChannel21,"Shea Wilson, candidate for City of Seattle, Council District 6",2023-07-12T13:00:01Z
SeattleChannel21,"Aaron Marshall, candidate for City of Seattle, Council District 7",2023-07-12T13:00:01Z
SeattleChannel21,"King County, Proposition No. 1, Veterans, Seniors and Human Services Levy",2023-07-12T13:00:00Z
SeattleChannel21,"Preston Anderson, candidate for City of Seattle, Council District 1",2023-07-12T13:00:00Z
SeattleChannel21,"Stephen Brown, candidate for City of Seattle, Council District 1",2023-07-12T13:00:00Z
SeattleChannel21,Seattle City Council 7/11/2023,2023-07-11T21:57:40Z
SeattleChannel21,Public Safety and Human Services Committee 7/11/23,2023-07-11T20:43:43Z
SeattleChannel21,Seattle City Council Briefing 7/10/2023,2023-07-10T23:07:52Z
SeattleChannel21,Public Assets & Homelessness Committee 7/7/23,2023-07-07T23:38:11Z
SeattleChannel21,A tale of two Matts taking the Seattle sports world by storm,2023-07-07T21:22:37Z
SeattleChannel21,City leaders share preparation details for MLB All-Star Game and All-Star Week,2023-07-07T19:47:26Z
SeattleChannel21,"Bobby Goodwin, candidate for City of Seattle, Council District 3",2023-07-07T16:21:47Z
SeattleChannel21,Land Use Committee Special Meeting 7/6/23,2023-07-06T19:43:01Z
SeattleChannel21,"Seattle City Council: July 5, 2023",2023-07-05T22:24:57Z
SeattleChannel21,Book Lust: Dan Berger's new book reveals untold stories of Black Power movement,2023-07-03T16:07:40Z
SeattleChannel21,Sustainability & Renters' Rights Committee 6/30/23,2023-06-30T21:47:48Z
SeattleChannel21,Seattle Fire & Seattle City Light showcase their new equipment for energy fires,2023-06-29T22:58:28Z
SeattleChannel21,Land Use Committee Special Meeting 6/28/23,2023-06-29T00:32:53Z
SeattleChannel21,Mayor announces details of Downtown Activation Plan,2023-06-28T20:55:14Z
SeattleChannel21,"Committee on Economic Development, Technology, and City Light 6/28/23",2023-06-28T16:50:31Z
SeattleChannel21,Seattle City Council 6/27/23,2023-06-28T01:24:32Z
SeattleChannel21,MudHoney Breaks Through,2023-06-28T00:08:17Z
SeattleChannel21,Greenwood Car Show rolls through town,2023-06-27T21:46:52Z
SeattleChannel21,Seattle City Council Public Safety & Human Services Committee 6/27/23,2023-06-27T21:33:01Z
SeattleChannel21,Seattle Park District Board meeting - 6/26/23,2023-06-27T15:23:48Z
SeattleChannel21,Seattle City Council Briefing 6/26/23,2023-06-27T00:07:04Z
SeattleChannel21,Seattle City Council Land Use Committee Special Meeting - Public Hearing - 6/26/23,2023-06-26T18:09:02Z
SeattleChannel21,Pioneer Squares LGBTQ+ History,2023-06-23T22:31:00Z
SeattleChannel21,"""It tastes like home."" Popular Filipino diner returns to Downtown Seattle",2023-06-23T20:48:18Z
SeattleChannel21,"Art Zone: Two Seattle creatives say goodbye, sculptures at MoM & more",2023-06-22T20:03:49Z
SeattleChannel21,A fond farewell to the beloved Linda Hodges Gallery,2023-06-22T19:51:34Z
SeattleChannel21,The visceral world of artist Camille Patha,2023-06-22T19:45:59Z
SeattleChannel21,Bernie Griffin reflects on her storied career at The 5th Avenue Theatre,2023-06-22T19:34:28Z
SeattleChannel21,INSTALLATION at Museum of Museums: ¡°Sea of Vapors¡± from sculptor Emily Counts,2023-06-22T19:26:56Z
SeattleChannel21,Happy hour with an arty twist at First Hill's The Hideout.,2023-06-22T19:04:10Z
SeattleChannel21,Seattle City Council Public Assets and Homelessness Committee 6/21/2023,2023-06-21T23:51:40Z
SeattleChannel21,Council Edition: Alex Pedersen talks transportation & taxes,2023-06-21T17:32:42Z
SeattleChannel21,Seattle City Council 6/20/23,2023-06-20T23:41:49Z
SeattleChannel21,Seattle City Council Transportation & Seattle Public Utilities Committee 6/20/23,2023-06-20T20:42:34Z
SeattleChannel21,Travel the MudHoney boring-machine's subterranean commute,2023-06-15T23:54:21Z
SeattleChannel21,Sharon Nyree Williams recites poem ¡°Juneteenth: Freedom is...¡±,2023-06-15T21:27:36Z
SeattleChannel21,"Governance, Native Communities & Tribal Governments Committee 6/15/23",2023-06-15T17:21:32Z
SeattleChannel21,Land Use Committee 6/14/23,2023-06-15T00:43:08Z
SeattleChannel21,"Economic Development, Technology & City Light Committee 6/14/23",2023-06-14T17:13:51Z
SeattleChannel21,Mayor signs legislation to place housing levy on ballot,2023-06-14T01:16:41Z
SeattleChannel21,"City Council Meeting June 13, 2023",2023-06-13T22:46:06Z
SeattleChannel21,City Hall Park reopens to public with grand opening celebration,2023-06-13T21:35:11Z
SeattleChannel21,Public Safety and Human Services Committee 6/13/23,2023-06-13T21:07:47Z
SeattleChannel21,Mayor shares next steps to address drug Intervention & enforcement,2023-06-12T21:14:20Z
SeattleChannel21,Tanya Kim sworn in as director of Seattle Human Services Department,2023-06-09T22:37:30Z
SeattleChannel21,Derrick Wheeler-Smith sworn in as director of Office for Civil Rights,2023-06-09T22:30:55Z
SeattleChannel21,Mayor announces new policy to reduce emissions through clean buildings,2023-06-08T23:47:57Z
SeattleChannel21,PSA: 5 ways to support youth mental health short,2023-06-08T20:47:40Z
SeattleChannel21,PSA: 5 ways to support youth mental health,2023-06-08T20:45:10Z
SeattleChannel21,Land Use Committee Special Meeting 6/8/23,2023-06-08T20:37:13Z
SeattleChannel21,Art Zone previews your Seattle summer of live music,2023-06-08T18:50:44Z
SeattleChannel21,Mayor announces new youth mental health initiative,2023-06-08T00:30:04Z
SeattleChannel21,Public Assets & Homelessness Committee 6/7/23,2023-06-07T23:18:14Z
SeattleChannel21,Councilmember Pedersen pitches tax reform to make system more fair for Seattle,2023-06-07T21:19:30Z
SeattleChannel21,City unveils winners of office-to-residential conversion design competition,2023-06-07T18:52:07Z
SeattleChannel21,PSA: HAGS (¡°have a great summer¡±),2023-06-07T18:17:52Z
SeattleChannel21,Select Committee on the 2023 Housing Levy 6/7/23,2023-06-07T17:58:29Z
SeattleChannel21,PSA: How to Talk to Me,2023-06-07T16:18:49Z
SeattleChannel21,"City Council Meeting June 6, 2023",2023-06-07T03:37:30Z
SeattleChannel21,Committee on Transportation and Seattle Public Utilities 6/6/22,2023-06-06T18:36:04Z
SeattleChannel21,Seattle City Council Briefing 6/5/23,2023-06-05T23:08:35Z
SeattleChannel21,Councilmember Mosqueda & partners announce legislation renewing the Seattle Housing Levy,2023-06-05T15:50:34Z
SeattleChannel21,Seattle City Hall comes together for Pride Month,2023-06-02T23:23:38Z
SeattleChannel21,Sustainability & Renters' Rights Committee 6/2/23,2023-06-02T17:28:04Z
SeattleChannel21,City of Seattle celebrates Pride Month with flag raising,2023-06-02T16:00:34Z
SeattleChannel21,Reuniting the Duwamish River to its past through art & sound,2023-06-01T23:05:04Z
SeattleChannel21,Liberty Project focuses on increasing revenue for Black-owned businesses,2023-06-01T21:15:11Z
SeattleChannel21,Seattle City Council Select Committee on the 2023 Housing Levy Public Hearing 5/31/23,2023-06-01T01:30:45Z
SeattleChannel21,"""It's a proud moment.""  WWII Japanese American survivors saluted with U.S. flag.",2023-05-31T23:56:34Z
SeattleChannel21,Seattle City Council Select Committee on the 2023 Housing Levy 5/31/23,2023-05-31T22:10:06Z
SeattleChannel21,Seattle City Council 5/30/23,2023-05-30T21:43:06Z
SeattleChannel21,Mayor Harrell kicks off One Seattle Day of Service,2023-05-25T21:34:21Z
SeattleChannel21,Seattle City Council Land Use Committee 5/24/23,2023-05-25T01:33:57Z
SeattleChannel21,"Committee on Economic Development, Technology, and City Light 5/24/23",2023-05-24T17:58:29Z
SeattleChannel21,Seattle City Council 5/23/2023,2023-05-24T01:56:41Z
SeattleChannel21,Council Edition: Sara Nelson shares ideas on new public safety approach & more,2023-05-23T22:23:38Z
SeattleChannel21,Public Safety and Human Services Committee 5/23/23,2023-05-23T21:23:09Z
SeattleChannel21,"Nearly 4,000 volunteers come out for One Seattle Day of Service",2023-05-23T15:51:11Z
SeattleChannel21,Seattle City Council Briefing 5/22/23,2023-05-22T23:58:57Z
SeattleChannel21,City Inside/Out: Get the scoop on news headlines from local journalists,2023-05-19T16:19:28Z
SeattleChannel21,Mayor Harrell signs Metropolitan Improvement District renewal legislation,2023-05-18T20:47:43Z
SeattleChannel21,Seattle City Council Public Assets & Homelessness Committee 5/17/23,2023-05-18T00:43:51Z
SeattleChannel21,"Committee on Finance and Housing, May 17, 2023",2023-05-17T20:52:07Z
SeattleChannel21,Seattle City Council 5/16/23,2023-05-16T22:12:01Z
SeattleChannel21,Committee on Transportation and Seattle Public Utilities 5/16/22,2023-05-16T18:57:36Z
SeattleChannel21,Land Use Committee Special Meeting Session - 5/15/23,2023-05-15T23:25:04Z
SeattleChannel21,AIDS memorial inspires reflection & remembrance,2023-05-15T22:46:56Z
SeattleChannel21,"Governance, Native Communities & Tribal Governments Committee Special Meeting 5/15/23",2023-05-15T18:10:58Z
SeattleChannel21,"Neighborhoods, Education, Civil Rights and Culture Committee 5/12/23",2023-05-12T17:18:06Z
SeattleChannel21,Art Zone: Up close and personal with Benicio Bryant,2023-05-11T22:21:53Z
SeattleChannel21,City Inside/Out: Schools across state face shrinking budgets & enrollment,2023-05-11T20:34:25Z
SeattleChannel21,"Art Zone: Master guitar maker McAlister, Roq La Rue Gallery turns 25 & more!",2023-05-11T19:15:59Z
SeattleChannel21,The magical master guitar maker Roy McAlister,2023-05-11T19:06:30Z
SeattleChannel21,Celebrating 25 years of cutting-edge art at Roq La Rue Gallery,2023-05-11T19:03:01Z
SeattleChannel21,SIFF 2023 brings 264 films to the big screen,2023-05-11T19:01:54Z
SeattleChannel21,New book ¡°Filmlandia!" is a movie lover's guide to PNW films,2023-05-11T19:00:02Z
SeattleChannel21,Music sensation Benicio?Bryant performs hit single ¡°I CAN¡¯T DANCE TO THIS¡±,2023-05-11T18:25:59Z
SeattleChannel21,Seattle City Council Land Use Committee 5/10/23,2023-05-11T00:28:36Z
SeattleChannel21,"Committee on Economic Development, Technology, and City Light 5/10/23",2023-05-10T17:16:59Z
SeattleChannel21,Seattle City Council 5/9/23,2023-05-09T23:58:51Z
SeattleChannel21,Public Safety and Human Services Committee 5/9/23,2023-05-09T21:27:33Z
SeattleChannel21,"Meet Markham McIntyre, Director of Office of Economic Development",2023-05-09T16:30:57Z
SeattleChannel21,Seattle City Council Briefing 5/8/23,2023-05-08T23:13:59Z
SeattleChannel21,Seattle Public Library takes a stand with Books Unbanned initiative,2023-05-08T20:11:55Z
SeattleChannel21,City of Seattle Tribal Nations Summit,2023-05-06T00:09:42Z
SeattleChannel21,Inflation and the Economy,2023-05-05T16:00:25Z
SeattleChannel21,Land Use Committee Special Meeting Session II - 5/4/23,2023-05-05T00:19:20Z
SeattleChannel21,Land Use Committee Special Meeting 4/26/23,2023-05-04T20:20:00Z
SeattleChannel21,Public Assets & Homelessness Committee - Public Hearing 5/3/23,2023-05-03T22:28:09Z
SeattleChannel21,R2-D2 Builders Club Expo has the droids you're looking for,2023-05-03T21:32:04Z
SeattleChannel21,Select Committee on the 2023 Housing Levy 5/3/23,2023-05-03T19:45:53Z
SeattleChannel21,Seattle City Council 5/2/2023,2023-05-02T22:50:59Z
SeattleChannel21,Committee on Transportation and Seattle Public Utilities 5/2/22,2023-05-02T18:57:14Z
SeattleChannel21,"Neighborhoods, Education, Civil Rights & Culture Committee 4/28/23",2023-04-28T18:30:59Z
SeattleChannel21,Proposed legislation would prohibit public consumption of controlled substances,2023-04-27T20:51:06Z
SeattleChannel21,Seattle City Council Land Use Committee meeting of 4/26/23,2023-04-27T01:20:02Z
SeattleChannel21,"Economic Development, Technology & City Light Committee 4/26/23",2023-04-26T18:48:16Z
SeattleChannel21,CityStream: Life Through the Lens of Al Smith,2023-04-26T16:20:22Z
SeattleChannel21,CityStream: New Mariners Training Centers Encourage Diversity,2023-04-26T16:20:13Z
SeattleChannel21,"CityStream: Life Through the Lens of Al Smith, Batter Up & Free Health Care",2023-04-26T16:20:03Z
SeattleChannel21,Seattle City Council 4/25/23,2023-04-25T22:35:00Z
SeattleChannel21,Public Safety and Human Services Committee 4/25/23,2023-04-25T20:23:25Z
SeattleChannel21,"Mayor Harrell announces Swim Seattle, a new water safety initiative",2023-04-24T23:06:36Z
SeattleChannel21,Council Briefing 4/24/23,2023-04-24T22:44:39Z
SeattleChannel21,Seattle City Council Land Use Committee Special Meeting - Public Hearing 4/24/23,2023-04-24T21:36:50Z
SeattleChannel21,Land Use Committee Special Meeting 4/21/23,2023-04-21T23:36:58Z
SeattleChannel21,"Councilmember Lewis discusses downtown Seattle transformations, RHA budget & more",2023-04-21T23:24:30Z
SeattleChannel21,City Inside/Out: Protecting Seattle's shrinking tree canopy,2023-04-21T19:08:01Z
SeattleChannel21,Seattle City Council Select Committee on the 2023 Housing Levy Public Hearing 4/19/23,2023-04-20T02:13:44Z
SeattleChannel21,Seattle City Council Public Assets & Homelessness Committee 4/19/23,2023-04-20T00:53:51Z
SeattleChannel21,Seattle University Conversations: Governor Jay Inslee,2023-04-19T23:09:55Z
SeattleChannel21,Elsa Sjunneson discusses Being Seen,2023-04-19T20:29:33Z
SeattleChannel21,Select Committee on the 2023 Housing Levy 4/19/23,2023-04-19T20:12:52Z
SeattleChannel21,Book Lust: Author Nina Siegal's "The Diary Keepers" proves the power of a journal,2023-04-19T16:32:17Z
SeattleChannel21,Seattle City Council 4/18/2023,2023-04-19T02:02:24Z
SeattleChannel21,Volunteer effort translates to a big impact at Seattle/King County Clinic,2023-04-18T18:29:44Z
SeattleChannel21,Mayor Harrell shares plans to revitalize Downtown; addresses public safety & health,2023-04-17T22:04:36Z
SeattleChannel21,"Neighborhoods, Education, Civil Rights and Culture Committee 4/14/23",2023-04-14T17:09:37Z
SeattleChannel21,"Art Zone: Community builder Carolyn Hitt, Dawn Bassett's perfect plaster & more",2023-04-13T20:47:54Z
SeattleChannel21,"Artist Carolyn Hitt: Capitol Hill's mover, shaker & community builder",2023-04-13T20:47:23Z
SeattleChannel21,The immersive imagination of painter Katherine Bradford,2023-04-13T20:46:56Z
SeattleChannel21,Dawn Bassett brings fresh eyes to ancient art of plaster,2023-04-13T20:46:33Z
SeattleChannel21,Eric Pitsenbarger captures an unconventional childhood in his new memoir,2023-04-13T20:46:13Z
SeattleChannel21,Seattle band brings adjective "Awesome" to life,2023-04-13T20:45:45Z
SeattleChannel21,Local leaders announce groundbreaking urban forestry collaborative,2023-04-13T18:32:03Z
SeattleChannel21,"Economic Development, Technology & City Light Committee - Public Hearing 4/12/23",2023-04-12T21:14:25Z
SeattleChannel21,2023 One Seattle Day of Service Announcement,2023-04-12T19:20:08Z
SeattleChannel21,CityStream: Seattle Moisture Festival,2023-04-11T23:09:10Z
SeattleChannel21,Seattle City Council 4/11/23,2023-04-11T22:22:39Z
SeattleChannel21,CityStream: The Northwest Wine Academy at South Seattle College,2023-04-11T22:06:59Z
SeattleChannel21,CityStream: Duwamish River Cleanup Seen Up Close,2023-04-11T21:56:34Z
SeattleChannel21,Public Safety and Human Services Committee 4/11/23,2023-04-11T20:40:05Z
SeattleChannel21,"CityStream: Duwamish Cleanup Up Close, Winemaking 101 & Moisture Festival",2023-04-11T20:21:48Z
SeattleChannel21,Seattle City Council Briefing 4/10/23,2023-04-10T23:34:45Z
SeattleChannel21,Economic and Revenue Forecast Council meeting of 4/10/23,2023-04-10T19:51:04Z
SeattleChannel21,Land Use Committee Special Meeting 4/7/23,2023-04-08T00:28:19Z
SeattleChannel21,Sustainability & Renters' Rights Committee 4/7/23,2023-04-07T20:07:05Z
SeattleChannel21,City Inside/Out: April vote on new King County crisis care centers,2023-04-07T17:03:27Z
SeattleChannel21,Seattle City Council Committee on Public Assets and Homelessness 4/5/23,2023-04-05T23:11:18Z
SeattleChannel21,Seattle City Council Select Committee on the 2023 Housing Levy 4/5/23,2023-04-05T21:30:45Z
SeattleChannel21,Seattle City Council 4/4/23,2023-04-04T23:14:21Z
SeattleChannel21,2023 RSJI Summit: Food Sovereignty,2023-04-04T20:15:20Z
SeattleChannel21,Committee on Transportation and Seattle Public Utilities 4/4/22,2023-04-04T17:39:37Z
SeattleChannel21,2023 RSJI Summit: Dr. Ben Danielson delivers keynote address,2023-04-04T00:31:56Z
SeattleChannel21,Seattle Park District Board - 4/3/23,2023-04-04T00:29:24Z
SeattleChannel21,Seattle City Council Briefing 4/3/23,2023-04-03T22:49:45Z
SeattleChannel21,WHIAANHPI Economic Summit: Advancing Equity Through the Federal Government,2023-04-03T18:02:16Z
SeattleChannel21,"White House Initiative on Asian Americans, Native Hawaiians, & Pacific Islanders Economic Summit",2023-04-03T18:01:00Z
SeattleChannel21,WHIAANHPI Economic Summit: Armchair Discussion with Mayor Bruce Harrell & Hood Famous' Chera Amlag,2023-04-03T17:54:55Z
SeattleChannel21,"White House Initiative on Asian Americans, Native Hawaiians, & Pacific Islanders Economic Summit",2023-03-31T23:12:38Z
SeattleChannel21,CityStream: Seattle's new shimmering & vertical convention center opens,2023-03-30T23:29:06Z
SeattleChannel21,Mayor Harrell announces $970 million housing levy proposal,2023-03-30T22:57:30Z
SeattleChannel21,CityStream: Aviation Restoration & Convention Center Expansion,2023-03-30T22:04:36Z
SeattleChannel21,"Council Edition: Councilmember Morales on Vision Zero, social housing & more",2023-03-30T20:42:55Z
SeattleChannel21,A stroll through historic Pike Place Market,2023-03-30T18:44:09Z
SeattleChannel21,Mayor signs paid sick & safe time bill for app-based workers,2023-03-29T22:23:33Z
SeattleChannel21,Seattle Within Reach: Arts & Culture,2023-03-29T20:45:14Z
SeattleChannel21,Land Use Committee Special Meeting 3/29/23,2023-03-29T18:52:06Z
SeattleChannel21,Museum of Flight restoration team returns luster to legendary planes,2023-03-29T15:57:01Z
SeattleChannel21,"City Council Meeting March 28, 2023",2023-03-29T00:31:30Z
SeattleChannel21,International Women's Day - What's Equity Got to Do With It?,2023-03-28T20:44:44Z
SeattleChannel21,The Clean Energy Workforce: Opportunities and Challenges for Women,2023-03-28T20:09:28Z
SeattleChannel21,Public Safety & Human Services Committee 3/28/23,2023-03-28T20:08:58Z
SeattleChannel21,"City of Seattle, Department of Justice file new SPD accountability agreement",2023-03-28T19:48:09Z
SeattleChannel21,"International Women's Day - Family, Politics & Career: Promoting Change & Balancing Responsibilities",2023-03-28T18:54:55Z
SeattleChannel21,International Women's Day - Inspire Change: Diversity Center of Seattle,2023-03-28T18:08:55Z
SeattleChannel21,"Neighborhoods, Education, Civil Rights & Culture Committee 3/24/23",2023-03-24T20:01:15Z
SeattleChannel21,Seattle City Council Land Use Committee 3/22/23,2023-03-23T01:21:25Z
SeattleChannel21,"Economic Development, Technology & City Light Committee 3/22/23",2023-03-22T20:05:08Z
SeattleChannel21,City Inside/Out: Helping the hungry when SNAP benefits shrink while food prices soar,2023-03-22T19:12:46Z
SeattleChannel21,Seattle City Council 3/21/2023,2023-03-21T22:04:29Z
SeattleChannel21,Seattle City Council Committee on Transportation and Seattle Public Utilities 3/21/22,2023-03-21T21:02:33Z
SeattleChannel21,"Moss, the brilliant green icon of the Pacific Northwest, and the microscopic world it supports",2023-03-21T16:51:13Z
SeattleChannel21,Seattle City Council Briefing 3/20/23,2023-03-20T23:55:45Z
SeattleChannel21,"Committee on Finance and Housing, March 20, 2023",2023-03-20T19:58:58Z
SeattleChannel21,Sustainability and Renters' Rights Committee 3/17/23,2023-03-17T19:41:07Z
SeattleChannel21,City Inside/Out: Will new gun bills make the state safer?,2023-03-17T19:36:53Z
SeattleChannel21,Seattle City Council Public Assets & Homelessness Committee 3/15/23,2023-03-16T00:13:46Z
SeattleChannel21,"Mayor kicks off 2023-2024 Seattle Preschool Program, announces program expansion",2023-03-15T23:20:15Z
SeattleChannel21,Finance & Housing Committee 3/15/23,2023-03-15T20:22:50Z
SeattleChannel21,Seattle City Council 3/14/23,2023-03-14T23:10:51Z
SeattleChannel21,CityStream: SMASH: Healthcare Assistance for Musicians,2023-03-14T21:36:57Z
SeattleChannel21,CityStream: Seattle ReCreative Turns Trash into Treasures,2023-03-14T21:36:37Z
SeattleChannel21,"CityStream: Julia Colson, Project Director discusses the Seattle/King County Clinic",2023-03-14T21:36:11Z
SeattleChannel21,CityStream: Healthcare Help & Women Who Lead the Way,2023-03-14T21:35:12Z
SeattleChannel21,Public Safety and Human Services Committee 3/14/23,2023-03-14T20:03:33Z
SeattleChannel21,"Meet Kimberly Loving, Director of Seattle Department of Human Resources",2023-03-14T15:55:09Z
SeattleChannel21,Willow Bader paints to the rhythm of her own life,2023-03-14T00:58:59Z
SeattleChannel21,Councilmember Kshama Sawant joins PCC workers,2023-03-14T00:44:33Z
SeattleChannel21,Seattle City Council Briefing 3/13/23,2023-03-13T23:50:49Z
SeattleChannel21,Community Stories: Path with Art,2023-03-10T22:42:55Z
SeattleChannel21,"Neighborhoods, Education, Civil Rights & Culture Committee 3/10/23",2023-03-10T19:22:32Z
SeattleChannel21,City of Seattle Economic and Revenue Forecast Council meeting of 3/9/23,2023-03-10T00:45:03Z
SeattleChannel21,"Art Zone: Storyteller Eva Abram, Seattle's neon lights & more",2023-03-09T21:00:05Z
SeattleChannel21,Rock & power-pop sounds of Appaloosa in song "No Hope For the Kids",2023-03-09T20:56:29Z
SeattleChannel21,The powerful storytelling of Eva Abram,2023-03-09T20:48:59Z
SeattleChannel21,Seattle's neon lights glow in new book,2023-03-09T20:41:32Z
SeattleChannel21,Land Use Committee 3/8/23,2023-03-09T01:19:48Z
SeattleChannel21,"Economic Development, Technology & City Light Committee 3/8/23",2023-03-08T22:36:01Z
SeattleChannel21,State of Africatown: Celebrating a Decade of Realizing the Vision of Black Seattle,2023-03-08T01:26:48Z
SeattleChannel21,Designing With Intention: Three Generations of Black Architects,2023-03-08T00:01:32Z
SeattleChannel21,Seattle City Council 3/7/23,2023-03-07T22:53:45Z
SeattleChannel21,Transportation & Seattle Public Utilities Committee 3/7/23,2023-03-07T21:59:58Z
SeattleChannel21,Seattle City Council Briefing 3/6/23,2023-03-06T23:32:16Z
SeattleChannel21,Book Lust: Michael Schulman's "Oscar Wars" puts a spotlight on Hollywood history,2023-03-06T21:57:59Z
SeattleChannel21,City Inside/Out: Lawmakers look to reform recycling,2023-03-03T19:37:35Z
SeattleChannel21,Seattle City Council Public Assets & Homelessness Committee 3/1/23,2023-03-02T00:52:16Z
SeattleChannel21,Seattle University Conversations: U.S. Representative Marie Gluesenkamp Perez,2023-03-02T00:36:34Z
SeattleChannel21,Community comes together to continue D'vonne Pickett Jr.'s legacy of love & positivity,2023-03-01T02:11:14Z
SeattleChannel21,Seattle City Council 2/28/23,2023-02-28T23:43:26Z
SeattleChannel21,Public Safety & Human Services Committee 2/28/23,2023-02-28T20:45:48Z
SeattleChannel21,Council Briefing 2/27/23,2023-02-28T00:35:04Z
SeattleChannel21,Council Edition: Councilmember Mosqueda shares her vision for downtown & more,2023-02-27T23:22:53Z
SeattleChannel21,Pink Gorilla engages Seattle's passionate gaming community,2023-02-27T17:42:08Z
SeattleChannel21,Seattle University Conversations: Congressperson Marie Gluesenkamp Perez,2023-02-25T00:34:31Z
SeattleChannel21,"Neighborhoods, Education, Civil Rights & Culture Committee 2/24/23",2023-02-24T19:50:33Z
SeattleChannel21,City leaders honor D'Vonne Pickett Jr. with honorary designation of E. Union,2023-02-23T20:33:10Z
SeattleChannel21,CityStream: Seattle Center Director Calls it a Career,2023-02-23T18:04:57Z
SeattleChannel21,"CityStream: Wais Ali, East Africa Fine Art",2023-02-23T18:04:35Z
SeattleChannel21,CityStream: Diversity in Dance & Retiring with Grace,2023-02-23T17:54:08Z
SeattleChannel21,"CityStream: J.B. Johnson, BLMF Literary Saloon",2023-02-23T17:53:53Z
SeattleChannel21,"CityStream: Deborah Boone, Our Fabric Stash",2023-02-23T17:53:42Z
SeattleChannel21,CityStream: PNB Names First Black Principal Dancer,2023-02-23T17:25:08Z
SeattleChannel21,Land Use Committee 2/22/23,2023-02-23T00:43:58Z
SeattleChannel21,Seattle Within Reach: Environmental & Climate Justice,2023-02-22T22:58:17Z
SeattleChannel21,"Economic Development, Technology & City Light Committee 2/22/23",2023-02-22T19:43:59Z
SeattleChannel21,Seattle City Council 2/21/2023,2023-02-22T02:13:29Z
SeattleChannel21,Councilmember Sawant & community leaders rally for first-in-nation caste discrimination ban,2023-02-22T00:40:12Z
SeattleChannel21,Mayor Bruce Harrell delivers 2023 State of the City address,2023-02-21T21:41:45Z
SeattleChannel21,Transportation & Seattle Public Utilities Committee 2/21/23,2023-02-21T20:28:34Z
SeattleChannel21,History Caf¨¦: Paying Tribute to Seattle¡¯s Black Landmarks & their Namesakes,2023-02-17T01:38:01Z
SeattleChannel21,City Inside/Out: Drug Possession Debate,2023-02-17T00:14:23Z
SeattleChannel21,"Governance, Native Communities & Tribal Governments Committee 2/16/23",2023-02-16T18:03:05Z
SeattleChannel21,Public Assets & Homelessness Committee 2/15/23,2023-02-15T23:25:57Z
SeattleChannel21,"Get to know Seattle's top police officer, Adrian Diaz",2023-02-15T19:35:47Z
SeattleChannel21,Finance & Housing Committee 2/15/23,2023-02-15T19:04:42Z
SeattleChannel21,Seattle City Council 2/14/2023,2023-02-15T01:19:03Z
SeattleChannel21,¡°As the crow flies¡± happens to be over Seattle,2023-02-14T22:35:34Z
SeattleChannel21,Public Safety & Human Services Committee 2/14/23,2023-02-14T21:40:16Z
SeattleChannel21,Marita Dingus: Assembling a New Art of the African Diaspora,2023-02-14T21:25:25Z
SeattleChannel21,Seattle City Council Briefing 2/13/22,2023-02-14T00:48:56Z
SeattleChannel21,Land Use Committee 2/8/23,2023-02-13T22:38:48Z
SeattleChannel21,"Economic Development, Technology & City Light Committee 2/8/23",2023-02-13T22:18:41Z
SeattleChannel21,Council Briefing 2/6/23,2023-02-13T22:01:19Z
SeattleChannel21,"Battling Graffiti, Children¡¯s Film Fest & Caspar Babypants",2023-02-13T21:53:34Z
SeattleChannel21,City Council 2/7/23,2023-02-13T21:49:06Z
SeattleChannel21,Town Square: The Seattle Times Pictures of the Year 2022,2023-02-13T21:45:36Z
SeattleChannel21,CityStream: One Seattle Plan Battles a Surge in Graffiti,2023-02-13T21:30:54Z
SeattleChannel21,"Art Zone: Sublime singer Shaina Shepherd, bold colors of artist Brian Sanchez & more",2023-02-13T21:27:32Z
SeattleChannel21,CityStream: Children¡¯s Film Festival Seattle,2023-02-13T21:26:43Z
SeattleChannel21,Transportation & Seattle Public Utilities Committee 2/7/23,2023-02-13T21:25:17Z
SeattleChannel21,"Neighborhoods, Education, Civil Rights & Culture Committee 2/10/23",2023-02-13T21:06:34Z
SeattleChannel21,Lawmakers explore "Missing Middle" to address housing shortage,2023-02-13T21:00:58Z
SeattleChannel21,Powerhouse singing sensation Alessandra Rose performs ¡°Panic at Sunrise¡±,2023-02-13T20:55:20Z
SeattleChannel21,Comedian Lauren Weedman debuts one-woman show ¡°BLOWS¡± in Seattle,2023-02-13T20:51:26Z
SeattleChannel21,PROCESS: Brian Sanchez,2023-02-13T20:49:34Z
SeattleChannel21,The evolution of singer & songwriter Shaina Shepherd,2023-02-13T20:46:46Z
SeattleChannel21,"Katie Yamasaki discusses ""Shapes, Lines And Light: My Grandfathers American Journey""",2023-02-02T01:21:48Z
SeattleChannel21,Mayor signs E.O. supporting culturally responsive services for immigrant & refugee families,2023-02-01T23:06:13Z
SeattleChannel21,Finance & Housing Committee 2/1/23,2023-02-01T20:55:50Z
SeattleChannel21,Seattle City Council 1/31/23,2023-01-31T23:07:53Z
SeattleChannel21,Seattle celebrates Vietnamese Lunar New Year,2023-01-31T17:50:36Z
SeattleChannel21,Seattle City Council Briefing 1/30/23,2023-01-30T23:50:56Z
SeattleChannel21,"Neighborhoods, Education, Civil Rights & Culture Committee 1/27/23",2023-01-27T19:56:27Z
SeattleChannel21,City Inside/Out: State legislature explores direct cash payments to those living in poverty,2023-01-27T00:14:41Z
SeattleChannel21,Councilmember Lewis unveils amendment protecting Pike Place Market Historical Commission¡¯s authority,2023-01-26T22:19:27Z
SeattleChannel21,Discussing District 6 with Councilmember Dan Strauss,2023-01-25T21:20:59Z
SeattleChannel21,CityStream: Salmon ¡°Rest Stop¡± on the Duwamish,2023-01-25T15:41:22Z
SeattleChannel21,CityStream: Port of Seattle & Seattle Aquarium Team Up to Study Kelp,2023-01-25T15:41:17Z
SeattleChannel21,CityStream: Restoring the Kelp Forests of Puget Sound,2023-01-25T15:41:14Z
SeattleChannel21,Seattle City Council 1/24/2023,2023-01-25T01:13:27Z
